LZ,Date,Year,Month,Day,yr_day,yr_wk,day_type,HE1,HE2,HE3,HE4,HE5,HE6,HE7,HE8,HE9,HE10,HE11,HE12,HE13,HE14,HE15,HE16,HE17,HE18,HE19,HE20,HE21,HE22,HE23,HE24
ISONE,1/1/2000,2000,1,1,1,0,WE,0.0452,0.038,0.0311,0.0241,0.025,0.0335,0.0812,0.1249,0.1697,0.2646,0.3355,0.5254,0.5725,0.7373,0.7797,0.7997,0.8302,0.8501,0.8536,0.8374,0.8415,0.7751,0.6757,0.6927
ISONE,1/2/2000,2000,1,2,2,1,WE,0.4771,0.3646,0.3419,0.2865,0.2992,0.3235,0.286,0.3693,0.5235,0.6883,0.8427,0.9182,0.9488,0.9576,0.9644,0.9727,0.9725,0.9713,0.9706,0.9743,0.9746,0.9749,0.975,0.975
ISONE,1/3/2000,2000,1,3,3,1,WD,0.975,0.975,0.975,0.975,0.975,0.9749,0.9743,0.9704,0.9668,0.9636,0.9531,0.8367,0.6867,0.4844,0.315,0.2353,0.077,0.0277,0.0357,0.0299,0.0461,0.0872,0.1623,0.2161
ISONE,1/4/2000,2000,1,4,4,1,WD,0.306,0.5394,0.6522,0.7353,0.8393,0.9487,0.9664,0.9743,0.9739,0.975,0.975,0.975,0.975,0.9741,0.971,0.8947,0.9285,0.8643,0.9031,0.967,0.9138,0.9688,0.9711,0.9699
ISONE,1/5/2000,2000,1,5,5,1,WD,0.9399,0.8487,0.9191,0.9412,0.959,0.9522,0.9583,0.9585,0.9561,0.9631,0.9549,0.9577,0.9594,0.9617,0.9597,0.9369,0.8763,0.8996,0.9003,0.9053,0.8913,0.8659,0.8252,0.7211
ISONE,1/6/2000,2000,1,6,6,1,WD,0.6299,0.5479,0.4818,0.3692,0.2542,0.1545,0.1095,0.0865,0.0717,0.0598,0.0308,0.0344,0.0581,0.0628,0.0852,0.1292,0.159,0.2245,0.3011,0.3835,0.4745,0.4634,0.4717,0.5012
ISONE,1/7/2000,2000,1,7,7,1,WD,0.5098,0.4723,0.3823,0.3526,0.3345,0.2797,0.2471,0.3557,0.3799,0.3995,0.3872,0.4303,0.4846,0.6634,0.7008,0.778,0.8638,0.9063,0.9506,0.9669,0.9721,0.9712,0.9696,0.9641
ISONE,1/8/2000,2000,1,8,8,1,WE,0.957,0.9365,0.8947,0.8373,0.7515,0.6474,0.4976,0.4116,0.3159,0.2073,0.1501,0.1064,0.0985,0.0881,0.1221,0.1671,0.2123,0.296,0.3675,0.379,0.4027,0.4915,0.6481,0.6516
ISONE,1/9/2000,2000,1,9,9,2,WE,0.6411,0.6058,0.5409,0.5985,0.6419,0.6953,0.6963,0.6845,0.592,0.528,0.5265,0.5715,0.6842,0.7444,0.6392,0.5321,0.5473,0.5266,0.2892,0.165,0.0764,0.0476,0.0418,0.0505
ISONE,1/10/2000,2000,1,10,10,2,WD,0.0458,0.0422,0.0993,0.1795,0.2265,0.2941,0.3115,0.3609,0.5136,0.6161,0.7137,0.8368,0.9695,0.9734,0.9743,0.9723,0.975,0.975,0.975,0.975,0.975,0.975,0.9749,0.9749
ISONE,1/11/2000,2000,1,11,11,2,WD,0.9749,0.9747,0.9745,0.9742,0.9738,0.9722,0.9218,0.9475,0.9202,0.9376,0.9354,0.9264,0.9503,0.9633,0.9603,0.9644,0.9559,0.9648,0.975,0.975,0.975,0.975,0.9749,0.9749
ISONE,1/12/2000,2000,1,12,12,2,WD,0.9747,0.9745,0.9749,0.975,0.9749,0.9749,0.9748,0.9746,0.9748,0.9747,0.9744,0.9703,0.9667,0.9552,0.9568,0.9417,0.9624,0.9585,0.956,0.9666,0.965,0.961,0.9496,0.9069
ISONE,1/13/2000,2000,1,13,13,2,WD,0.7055,0.6282,0.4326,0.2998,0.1178,0.0678,0.05,0.0261,0.0575,0.1939,0.2814,0.683,0.8429,0.9222,0.8991,0.9563,0.966,0.9561,0.9687,0.9741,0.9738,0.9743,0.9744,0.9745
ISONE,1/14/2000,2000,1,14,14,2,WD,0.9746,0.9746,0.9746,0.9745,0.9744,0.9742,0.9743,0.9739,0.9744,0.9738,0.9727,0.9733,0.9716,0.9708,0.9718,0.9715,0.9719,0.9712,0.9738,0.9743,0.9735,0.9708,0.9717,0.9726
ISONE,1/15/2000,2000,1,15,15,2,WE,0.9729,0.9728,0.9718,0.9719,0.9678,0.9621,0.948,0.9089,0.8473,0.8075,0.6796,0.5228,0.416,0.3957,0.3518,0.2857,0.2423,0.168,0.1789,0.1242,0.1264,0.115,0.0554,0.0457
ISONE,1/16/2000,2000,1,16,16,3,WE,0.0568,0.0766,0.1065,0.239,0.4562,0.6921,0.8939,0.946,0.9713,0.975,0.975,0.975,0.975,0.975,0.975,0.9744,0.9697,0.9747,0.9747,0.975,0.9749,0.975,0.9748,0.9748
ISONE,1/17/2000,2000,1,17,17,3,WD,0.9746,0.9744,0.9749,0.9747,0.9746,0.9744,0.9746,0.9746,0.9747,0.9748,0.9747,0.9747,0.9747,0.9744,0.9742,0.974,0.9742,0.9735,0.9743,0.9742,0.9732,0.9742,0.973,0.9682
ISONE,1/18/2000,2000,1,18,18,3,WD,0.9705,0.9667,0.9564,0.9399,0.9217,0.8852,0.8597,0.8621,0.734,0.5608,0.4298,0.3641,0.2647,0.2108,0.1983,0.2031,0.194,0.1946,0.2809,0.2525,0.2902,0.3718,0.355,0.3633
ISONE,1/19/2000,2000,1,19,19,3,WD,0.3372,0.3956,0.3585,0.2697,0.2485,0.2588,0.2868,0.3565,0.345,0.3102,0.3213,0.2913,0.2574,0.2198,0.1921,0.2417,0.2731,0.325,0.4661,0.537,0.5505,0.4829,0.5333,0.435
ISONE,1/20/2000,2000,1,20,20,3,WD,0.3589,0.347,0.2549,0.1736,0.1143,0.1059,0.1155,0.163,0.1748,0.2115,0.1714,0.2563,0.2639,0.4029,0.6789,0.8182,0.9083,0.9596,0.9725,0.9742,0.9743,0.9743,0.9744,0.9743
ISONE,1/21/2000,2000,1,21,21,3,WD,0.9748,0.9746,0.9748,0.9749,0.9747,0.9747,0.9746,0.9746,0.9748,0.9749,0.9748,0.9746,0.975,0.975,0.975,0.975,0.975,0.9746,0.974,0.9748,0.9748,0.975,0.975,0.9748
ISONE,1/22/2000,2000,1,22,22,3,WE,0.9747,0.9745,0.9748,0.9746,0.9743,0.9745,0.9746,0.9745,0.9747,0.9748,0.9747,0.9742,0.9735,0.9732,0.9726,0.9722,0.9705,0.9669,0.9677,0.9691,0.961,0.9596,0.9383,0.9137
ISONE,1/23/2000,2000,1,23,23,4,WE,0.8917,0.8425,0.7061,0.4671,0.2752,0.1808,0.1089,0.0664,0.0211,0.006,0.0077,0.0492,0.0555,0.0573,0.0769,0.1096,0.2761,0.4224,0.4927,0.7576,0.7899,0.766,0.7123,0.5773
ISONE,1/24/2000,2000,1,24,24,4,WD,0.4716,0.6093,0.5803,0.5873,0.4736,0.4808,0.5121,0.4059,0.4552,0.3568,0.3727,0.3672,0.3929,0.4629,0.4304,0.429,0.396,0.4587,0.5189,0.5749,0.6315,0.7583,0.8571,0.9425
ISONE,1/25/2000,2000,1,25,25,4,WD,0.9695,0.9727,0.9741,0.9743,0.9747,0.9745,0.9747,0.9748,0.975,0.975,0.975,0.975,0.975,0.975,0.9745,0.9718,0.9456,0.7104,0.6831,0.936,0.9657,0.9494,0.966,0.9701
ISONE,1/26/2000,2000,1,26,26,4,WD,0.9685,0.9654,0.9641,0.9652,0.9569,0.9503,0.9024,0.8673,0.8976,0.8138,0.7556,0.7467,0.6931,0.5873,0.525,0.396,0.3729,0.4295,0.5865,0.6752,0.654,0.6792,0.7827,0.8354
ISONE,1/27/2000,2000,1,27,27,4,WD,0.8428,0.9067,0.96,0.9579,0.9106,0.86,0.788,0.7709,0.668,0.5805,0.5324,0.5244,0.5253,0.5681,0.6478,0.7402,0.7824,0.8068,0.8058,0.8821,0.9096,0.8435,0.8345,0.8888
ISONE,1/28/2000,2000,1,28,28,4,WD,0.8842,0.9125,0.9103,0.9031,0.8863,0.8997,0.9277,0.9399,0.9352,0.9365,0.9318,0.8821,0.7715,0.7397,0.7849,0.8464,0.9088,0.9529,0.9655,0.9727,0.9714,0.9711,0.9669,0.9633
ISONE,1/29/2000,2000,1,29,29,4,WE,0.9547,0.9542,0.9462,0.9044,0.8846,0.9259,0.9529,0.9164,0.8996,0.8594,0.7653,0.6326,0.5519,0.5307,0.5144,0.4337,0.3955,0.364,0.4202,0.406,0.3155,0.3027,0.3062,0.2794
ISONE,1/30/2000,2000,1,30,30,5,WE,0.1883,0.1373,0.1441,0.1219,0.0765,0.0489,0.0468,0.0575,0.0933,0.0745,0.0845,0.0726,0.0436,0.0217,0.0169,0.0145,0.0204,0.0211,0.0257,0.0379,0.0841,0.1337,0.1755,0.2327
ISONE,1/31/2000,2000,1,31,31,5,WD,0.3397,0.6801,0.9519,0.9728,0.9743,0.9747,0.9726,0.9743,0.9729,0.9745,0.9745,0.9745,0.975,0.9742,0.9742,0.9731,0.9688,0.9624,0.9562,0.9534,0.9638,0.9703,0.9607,0.9664
ISONE,2/1/2000,2000,2,1,32,5,WD,0.9569,0.9575,0.929,0.9434,0.947,0.9195,0.9216,0.8505,0.7258,0.7234,0.7362,0.6226,0.6255,0.644,0.709,0.7503,0.7999,0.8812,0.9346,0.9416,0.9635,0.9719,0.9731,0.9723
ISONE,2/2/2000,2000,2,2,33,5,WD,0.9728,0.9734,0.9733,0.9727,0.97,0.9561,0.9597,0.9414,0.9285,0.9672,0.9444,0.9712,0.973,0.9719,0.9723,0.9699,0.9697,0.9738,0.9746,0.9738,0.9735,0.9729,0.9747,0.9747
ISONE,2/3/2000,2000,2,3,34,5,WD,0.9712,0.9649,0.9586,0.9396,0.9078,0.8275,0.7664,0.6708,0.5809,0.5031,0.3979,0.332,0.2613,0.2207,0.2292,0.2049,0.1696,0.1025,0.048,0.0132,0.038,0.1313,0.2573,0.3188
ISONE,2/4/2000,2000,2,4,35,5,WD,0.3347,0.3747,0.4433,0.4755,0.4791,0.5349,0.5277,0.6648,0.649,0.632,0.6383,0.4597,0.4788,0.3745,0.34,0.3501,0.3535,0.381,0.4079,0.3342,0.2739,0.2627,0.2065,0.1987
ISONE,2/5/2000,2000,2,5,36,5,WE,0.1209,0.0968,0.0665,0.1027,0.0897,0.0703,0.1119,0.3414,0.4713,0.4471,0.4821,0.3429,0.4018,0.3964,0.5886,0.7603,0.803,0.9181,0.9587,0.9648,0.9684,0.9724,0.9742,0.9743
ISONE,2/6/2000,2000,2,6,37,6,WE,0.9727,0.9734,0.9736,0.9728,0.971,0.9681,0.9547,0.9309,0.9046,0.9252,0.9444,0.9512,0.9448,0.9382,0.9439,0.9356,0.8969,0.8555,0.7355,0.7859,0.706,0.5297,0.493,0.5771
ISONE,2/7/2000,2000,2,7,38,6,WD,0.7051,0.8571,0.8985,0.9569,0.9568,0.9667,0.9734,0.9742,0.9736,0.9733,0.9734,0.9685,0.9536,0.9541,0.9414,0.9158,0.9461,0.9472,0.9635,0.9655,0.9723,0.9717,0.9669,0.9462
ISONE,2/8/2000,2000,2,8,39,6,WD,0.9591,0.9509,0.9276,0.9107,0.8761,0.8223,0.7779,0.7188,0.6272,0.5218,0.3142,0.2081,0.1063,0.0355,0.0052,0.0049,0.0148,0.0306,0.0711,0.1375,0.1688,0.1679,0.2951,0.4104
ISONE,2/9/2000,2000,2,9,40,6,WD,0.4474,0.5341,0.6288,0.6882,0.7539,0.8339,0.8812,0.8923,0.9495,0.948,0.9449,0.9425,0.9631,0.9691,0.9664,0.9666,0.9726,0.9743,0.975,0.9748,0.9731,0.9601,0.9532,0.9334
ISONE,2/10/2000,2000,2,10,41,6,WD,0.9218,0.8895,0.6806,0.4246,0.3432,0.2335,0.2008,0.2784,0.3535,0.5083,0.4837,0.5302,0.5119,0.4895,0.5327,0.5368,0.5645,0.6356,0.7363,0.6422,0.5919,0.5223,0.3958,0.2621
ISONE,2/11/2000,2000,2,11,42,6,WD,0.1849,0.2665,0.2483,0.2915,0.2195,0.2511,0.3327,0.5198,0.8079,0.8569,0.9148,0.9214,0.9315,0.8986,0.8802,0.8952,0.912,0.9137,0.9056,0.9339,0.9612,0.9678,0.9699,0.9652
ISONE,2/12/2000,2000,2,12,43,6,WE,0.9631,0.9501,0.9419,0.9291,0.9026,0.8547,0.8032,0.7693,0.7814,0.6371,0.4888,0.3672,0.1934,0.1605,0.1469,0.097,0.0767,0.0392,0.0484,0.066,0.0494,0.0352,0.055,0.0763
ISONE,2/13/2000,2000,2,13,44,7,WE,0.08,0.0879,0.0721,0.0797,0.0809,0.0677,0.0463,0.0419,0.0277,0.0375,0.0302,0.0228,0.0069,0.0213,0.0415,0.1156,0.1628,0.2094,0.2972,0.2778,0.4878,0.6285,0.8863,0.952
ISONE,2/14/2000,2000,2,14,45,7,WD,0.9695,0.9648,0.9632,0.975,0.975,0.975,0.975,0.9748,0.9721,0.9749,0.9682,0.9172,0.9329,0.8324,0.9687,0.9741,0.9749,0.9717,0.971,0.9336,0.9371,0.9415,0.7701,0.6914
ISONE,2/15/2000,2000,2,15,46,7,WD,0.6192,0.7505,0.7085,0.7325,0.755,0.7308,0.7769,0.9211,0.9345,0.9096,0.8934,0.7987,0.7604,0.6968,0.6888,0.6409,0.5823,0.576,0.5717,0.4917,0.5064,0.3934,0.3163,0.2597
ISONE,2/16/2000,2000,2,16,47,7,WD,0.1282,0.0307,0.0085,0.0136,0.0144,0.047,0.1788,0.398,0.5743,0.7268,0.8144,0.8189,0.8501,0.9106,0.9512,0.9507,0.9579,0.9577,0.9392,0.9424,0.8934,0.7767,0.9056,0.9006
ISONE,2/17/2000,2000,2,17,48,7,WD,0.9493,0.9519,0.9411,0.9639,0.9604,0.9609,0.96,0.945,0.9245,0.8973,0.7468,0.6276,0.6249,0.5442,0.5086,0.4289,0.3635,0.3492,0.3282,0.4115,0.3703,0.2723,0.2156,0.1636
ISONE,2/18/2000,2000,2,18,49,7,WD,0.1294,0.1238,0.1045,0.1261,0.166,0.1188,0.088,0.0659,0.0655,0.0636,0.0714,0.0869,0.1543,0.24,0.4467,0.7084,0.8829,0.9547,0.9743,0.9742,0.9742,0.9732,0.9027,0.4214
ISONE,2/19/2000,2000,2,19,50,7,WE,0.3279,0.2773,0.3894,0.4095,0.4539,0.5474,0.6052,0.7466,0.6545,0.7874,0.8648,0.9041,0.9206,0.9498,0.9524,0.9663,0.9391,0.9375,0.8881,0.8348,0.7988,0.7048,0.6424,0.6004
ISONE,2/20/2000,2000,2,20,51,8,WE,0.5608,0.6326,0.5323,0.548,0.5365,0.3575,0.3259,0.3345,0.384,0.4081,0.3816,0.3759,0.4599,0.3956,0.4026,0.5554,0.6144,0.7548,0.8553,0.8547,0.8854,0.9145,0.9289,0.9432
ISONE,2/21/2000,2000,2,21,52,8,WD,0.9395,0.9013,0.9156,0.8838,0.881,0.8001,0.789,0.6988,0.5551,0.3505,0.2197,0.167,0.1215,0.1062,0.1244,0.086,0.0734,0.0867,0.0951,0.1333,0.1579,0.1823,0.101,0.0621
ISONE,2/22/2000,2000,2,22,53,8,WD,0.0713,0.0589,0.0472,0.0484,0.0638,0.0552,0.0497,0.0459,0.0525,0.0464,0.0553,0.0609,0.0706,0.0807,0.1037,0.1445,0.1807,0.193,0.168,0.1897,0.1813,0.1473,0.1871,0.1949
ISONE,2/23/2000,2000,2,23,54,8,WD,0.1825,0.2402,0.2638,0.2895,0.2642,0.3243,0.2763,0.3103,0.18,0.2399,0.2811,0.3476,0.4846,0.5259,0.6658,0.7715,0.8798,0.9581,0.9693,0.9721,0.9722,0.9729,0.9739,0.9737
ISONE,2/24/2000,2000,2,24,55,8,WD,0.97,0.9642,0.9232,0.8898,0.8925,0.85,0.8461,0.786,0.7899,0.7168,0.6708,0.6122,0.6436,0.6755,0.691,0.713,0.7219,0.7355,0.7093,0.6389,0.4528,0.397,0.3713,0.3704
ISONE,2/25/2000,2000,2,25,56,8,WD,0.3259,0.209,0.0763,0.031,0.0267,0.0326,0.0483,0.1112,0.2077,0.4518,0.5514,0.735,0.8181,0.9381,0.9623,0.9687,0.9709,0.9686,0.9632,0.9629,0.9522,0.9177,0.9465,0.9592
ISONE,2/26/2000,2000,2,26,57,8,WE,0.9459,0.9534,0.9476,0.9557,0.9304,0.9181,0.9328,0.9401,0.9528,0.9442,0.9439,0.8821,0.8649,0.857,0.8609,0.8347,0.8076,0.7352,0.6523,0.6944,0.7002,0.7435,0.841,0.8333
ISONE,2/27/2000,2000,2,27,58,9,WE,0.7038,0.5899,0.5118,0.52,0.4899,0.5011,0.5054,0.5253,0.4992,0.548,0.5655,0.7021,0.8388,0.896,0.9258,0.9455,0.9713,0.9742,0.9701,0.9698,0.9716,0.9739,0.9745,0.9747
ISONE,2/28/2000,2000,2,28,59,9,WD,0.9748,0.975,0.975,0.975,0.975,0.9746,0.9742,0.9724,0.9717,0.9639,0.9287,0.8817,0.8497,0.8675,0.8578,0.9159,0.9077,0.8494,0.8579,0.9122,0.9412,0.9616,0.9615,0.9522
ISONE,2/29/2000,2000,2,29,60,9,WD,0.945,0.9606,0.9552,0.9458,0.9666,0.9708,0.9681,0.9597,0.954,0.948,0.927,0.8853,0.8104,0.6696,0.5632,0.5257,0.5688,0.6108,0.6246,0.6212,0.6969,0.7468,0.654,0.5437
ISONE,3/1/2000,2000,3,1,61,9,WD,0.4381,0.3494,0.2666,0.2434,0.2145,0.1716,0.1324,0.0936,0.0614,0.0422,0.0203,0.0174,0.0236,0.0335,0.0702,0.0658,0.0985,0.1421,0.1668,0.2081,0.2517,0.2933,0.4309,0.6068
ISONE,3/2/2000,2000,3,2,62,9,WD,0.6871,0.7734,0.7751,0.7011,0.6154,0.6237,0.5732,0.6346,0.6481,0.6526,0.6198,0.5744,0.5902,0.7411,0.8049,0.9003,0.9319,0.9375,0.8939,0.8868,0.8559,0.9036,0.9578,0.9595
ISONE,3/3/2000,2000,3,3,63,9,WD,0.9639,0.9729,0.9722,0.9735,0.9722,0.9711,0.9708,0.9634,0.956,0.9464,0.8386,0.8202,0.7651,0.7512,0.7139,0.7832,0.8591,0.8775,0.8817,0.8923,0.9484,0.953,0.9667,0.9675
ISONE,3/4/2000,2000,3,4,64,9,WE,0.9648,0.9708,0.9677,0.9534,0.8928,0.8318,0.86,0.8226,0.772,0.6364,0.4056,0.3049,0.281,0.3207,0.4092,0.5853,0.7227,0.7358,0.7631,0.7586,0.5855,0.4995,0.4771,0.474
ISONE,3/5/2000,2000,3,5,65,10,WE,0.3328,0.2189,0.1432,0.141,0.1353,0.1293,0.151,0.1285,0.1679,0.2013,0.2028,0.172,0.2504,0.3245,0.5024,0.5886,0.4715,0.3671,0.6085,0.7261,0.8316,0.8798,0.8624,0.7814
ISONE,3/6/2000,2000,3,6,66,10,WD,0.7097,0.7633,0.8033,0.745,0.7129,0.8039,0.7975,0.8034,0.7666,0.7027,0.6603,0.5844,0.4186,0.2517,0.1418,0.0839,0.0679,0.0842,0.1314,0.1469,0.3883,0.4516,0.5429,0.5435
ISONE,3/7/2000,2000,3,7,67,10,WD,0.5176,0.4739,0.4083,0.3379,0.216,0.0842,0.0694,0.0493,0.1186,0.2115,0.3219,0.4579,0.663,0.7004,0.8625,0.9179,0.9424,0.952,0.969,0.9724,0.9734,0.9726,0.9721,0.9669
ISONE,3/8/2000,2000,3,8,68,10,WD,0.8917,0.6695,0.4104,0.2501,0.2156,0.3559,0.387,0.476,0.3632,0.4762,0.4214,0.2645,0.2005,0.2423,0.2415,0.2089,0.1942,0.1617,0.1398,0.167,0.226,0.2081,0.2595,0.3306
ISONE,3/9/2000,2000,3,9,69,10,WD,0.5059,0.8277,0.8555,0.931,0.9305,0.9567,0.9697,0.9735,0.9736,0.9728,0.9709,0.9683,0.9703,0.9722,0.9745,0.9744,0.9745,0.9746,0.9736,0.9739,0.9739,0.9747,0.9736,0.9745
ISONE,3/10/2000,2000,3,10,70,10,WD,0.9714,0.9348,0.9033,0.8397,0.8849,0.8868,0.8741,0.9379,0.9239,0.879,0.7261,0.6197,0.5355,0.477,0.4311,0.3303,0.2493,0.1907,0.1806,0.1736,0.1631,0.1124,0.1117,0.0953
ISONE,3/11/2000,2000,3,11,71,10,WE,0.0483,0.0809,0.0741,0.1135,0.1366,0.102,0.0834,0.0764,0.1085,0.1639,0.2455,0.2487,0.3592,0.429,0.4677,0.454,0.5137,0.7308,0.9436,0.9467,0.9745,0.975,0.975,0.975
ISONE,3/12/2000,2000,3,12,72,11,WE,0.975,0.975,0.975,0.975,0.975,0.975,0.975,0.974,0.9715,0.9743,0.9724,0.9663,0.9648,0.9462,0.913,0.8862,0.8647,0.9114,0.8641,0.9008,0.9547,0.9698,0.9708,0.9726
ISONE,3/13/2000,2000,3,13,73,11,WD,0.9738,0.9733,0.972,0.9641,0.9383,0.9403,0.9461,0.9321,0.865,0.8438,0.753,0.6507,0.5696,0.449,0.2871,0.2668,0.2877,0.3093,0.3498,0.3482,0.2809,0.2551,0.2149,0.1346
ISONE,3/14/2000,2000,3,14,74,11,WD,0.0676,0.0278,0.0153,0.0129,0.026,0.0436,0.0798,0.1074,0.1729,0.2625,0.3453,0.4074,0.4904,0.4843,0.4726,0.2774,0.2959,0.3047,0.2345,0.1873,0.22,0.2868,0.377,0.4752
ISONE,3/15/2000,2000,3,15,75,11,WD,0.4786,0.4169,0.426,0.491,0.5125,0.5615,0.6631,0.6915,0.7254,0.7194,0.7924,0.848,0.9044,0.9362,0.9684,0.9714,0.9743,0.9735,0.9729,0.9736,0.9746,0.975,0.9743,0.9739
ISONE,3/16/2000,2000,3,16,76,11,WD,0.9723,0.9745,0.9747,0.9745,0.9748,0.9745,0.9744,0.9745,0.9745,0.9741,0.9736,0.9729,0.9737,0.9742,0.974,0.9736,0.9726,0.9678,0.9523,0.9106,0.8368,0.7777,0.7508,0.7511
ISONE,3/17/2000,2000,3,17,77,11,WD,0.7333,0.764,0.7853,0.7464,0.5812,0.5289,0.7932,0.9739,0.975,0.975,0.975,0.975,0.9749,0.9747,0.9745,0.9748,0.9748,0.9744,0.9744,0.9742,0.9746,0.9749,0.9747,0.9745
ISONE,3/18/2000,2000,3,18,78,11,WE,0.9744,0.9743,0.9742,0.9729,0.9731,0.9718,0.9651,0.9499,0.9083,0.7907,0.8798,0.8325,0.8288,0.8789,0.8633,0.8354,0.7607,0.7373,0.7016,0.6863,0.5751,0.5311,0.5676,0.6052
ISONE,3/19/2000,2000,3,19,79,12,WE,0.5913,0.5279,0.6198,0.5928,0.5431,0.6067,0.6124,0.6457,0.6319,0.6591,0.7325,0.7614,0.7598,0.7321,0.7087,0.7031,0.7922,0.6467,0.6663,0.5776,0.5818,0.5326,0.5409,0.6023
ISONE,3/20/2000,2000,3,20,80,12,WD,0.6111,0.6325,0.663,0.6054,0.579,0.5509,0.5776,0.5628,0.5619,0.6475,0.6687,0.7246,0.7034,0.7849,0.7605,0.8613,0.8998,0.8855,0.8514,0.7839,0.7163,0.7238,0.6942,0.7184
ISONE,3/21/2000,2000,3,21,81,12,WD,0.6828,0.758,0.7537,0.7093,0.6957,0.6098,0.789,0.846,0.8727,0.9082,0.9372,0.9028,0.9341,0.9355,0.9481,0.9098,0.9172,0.9096,0.9069,0.9495,0.9512,0.838,0.8191,0.7839
ISONE,3/22/2000,2000,3,22,82,12,WD,0.7803,0.8117,0.7542,0.6253,0.6272,0.7207,0.7583,0.7789,0.717,0.7044,0.6094,0.4951,0.4916,0.478,0.4807,0.4606,0.4806,0.4153,0.3544,0.2565,0.247,0.265,0.3332,0.2946
ISONE,3/23/2000,2000,3,23,83,12,WD,0.2224,0.1844,0.1295,0.1762,0.1541,0.1808,0.1769,0.1674,0.2002,0.1896,0.1492,0.0983,0.0509,0.0162,0.0079,0.0031,0.0196,0.0317,0.0416,0.0236,0.0371,0.0602,0.1522,0.2738
ISONE,3/24/2000,2000,3,24,84,12,WD,0.4004,0.5146,0.5586,0.7084,0.6759,0.6183,0.7256,0.8326,0.7807,0.5063,0.3336,0.24,0.1749,0.1272,0.0581,0.0649,0.0965,0.0849,0.0887,0.0961,0.0573,0.0669,0.0576,0.0494
ISONE,3/25/2000,2000,3,25,85,12,WE,0.0303,0.0365,0.0311,0.0218,0.0105,0.0296,0.0584,0.1264,0.1702,0.2365,0.3258,0.4928,0.6797,0.8116,0.8625,0.9053,0.9331,0.9091,0.9599,0.969,0.9683,0.9679,0.9698,0.9695
ISONE,3/26/2000,2000,3,26,86,13,WE,0.967,0.9123,0.8748,0.7466,0.6945,0.5744,0.5174,0.5208,0.5978,0.5729,0.5356,0.4278,0.3929,0.4809,0.5789,0.7881,0.9055,0.9524,0.9334,0.8978,0.919,0.9454,0.8629,0.7369
ISONE,3/27/2000,2000,3,27,87,13,WD,0.4527,0.3714,0.1945,0.219,0.1399,0.1626,0.1388,0.152,0.1298,0.1253,0.066,0.0753,0.0899,0.0816,0.1736,0.3564,0.6249,0.8472,0.9495,0.9613,0.9707,0.9733,0.9454,0.9546
ISONE,3/28/2000,2000,3,28,88,13,WD,0.9665,0.9745,0.9748,0.9749,0.9749,0.975,0.975,0.975,0.9748,0.9743,0.9741,0.9742,0.9746,0.9749,0.974,0.9734,0.9733,0.9733,0.9709,0.9146,0.8524,0.869,0.8009,0.7301
ISONE,3/29/2000,2000,3,29,89,13,WD,0.5115,0.1918,0.22,0.3186,0.4024,0.4064,0.4951,0.4535,0.6448,0.7638,0.6588,0.8284,0.8628,0.9079,0.9505,0.9661,0.9677,0.9703,0.9715,0.9716,0.9674,0.9709,0.9655,0.9296
ISONE,3/30/2000,2000,3,30,90,13,WD,0.9228,0.8415,0.9,0.8296,0.7499,0.6114,0.4931,0.3869,0.2925,0.3746,0.3884,0.2637,0.2119,0.2075,0.1805,0.1727,0.2082,0.1991,0.1562,0.1654,0.1476,0.1373,0.1828,0.2349
ISONE,3/31/2000,2000,3,31,91,13,WD,0.3226,0.4207,0.5013,0.4396,0.4113,0.4005,0.387,0.4471,0.4538,0.294,0.2357,0.164,0.1637,0.1207,0.0905,0.0824,0.0877,0.0868,0.0702,0.0376,0.0455,0.0568,0.0588,0.0613
ISONE,4/1/2000,2000,4,1,92,13,WE,0.1006,0.2119,0.3759,0.4157,0.2524,0.1928,0.1503,0.0675,0.0811,0.0519,0.0447,0.0756,0.098,0.1942,0.3248,0.3309,0.3321,0.3395,0.4182,0.4152,0.4034,0.4347,0.4762,0.5673
ISONE,4/2/2000,2000,4,2,93,14,WE,0.6063,0.6195,0.6332,0.6469,0.5668,0.5496,0.7302,0.806,0.861,0.8994,0.928,0.9576,0.9692,0.9745,0.9748,0.9748,0.9748,0.9744,0.9746,0.9749,0.9747,0.9743,0.9729,0.9714
ISONE,4/3/2000,2000,4,3,94,14,WD,0.9723,0.9726,0.9683,0.9563,0.8974,0.7793,0.5991,0.2496,0.1438,0.0747,0.0415,0.041,0.0124,0.0363,0.0643,0.0948,0.154,0.2444,0.3081,0.3139,0.3013,0.3868,0.36,0.43
ISONE,4/4/2000,2000,4,4,95,14,WD,0.4211,0.5599,0.8973,0.9741,0.975,0.975,0.9698,0.9649,0.9607,0.9682,0.9704,0.9647,0.842,0.9037,0.9679,0.9749,0.975,0.9749,0.9739,0.9745,0.9685,0.9377,0.9263,0.778
ISONE,4/5/2000,2000,4,5,96,14,WD,0.8381,0.8448,0.8379,0.7849,0.8202,0.8793,0.9207,0.908,0.9229,0.9174,0.911,0.8842,0.8791,0.9208,0.9483,0.9726,0.9733,0.9727,0.9727,0.9744,0.9745,0.9738,0.9737,0.9712
ISONE,4/6/2000,2000,4,6,97,14,WD,0.9667,0.9481,0.9145,0.8522,0.8286,0.7735,0.7236,0.6294,0.5481,0.5379,0.6884,0.7543,0.73,0.9653,0.9741,0.9749,0.9749,0.9748,0.9749,0.9748,0.974,0.9724,0.9632,0.8733
ISONE,4/7/2000,2000,4,7,98,14,WD,0.8164,0.7473,0.6643,0.6936,0.6409,0.6614,0.7351,0.7115,0.7088,0.6959,0.5614,0.4887,0.3834,0.3478,0.386,0.4085,0.4121,0.3978,0.3726,0.3088,0.3257,0.2758,0.2361,0.2923
ISONE,4/8/2000,2000,4,8,99,14,WE,0.5201,0.7831,0.8843,0.9633,0.9749,0.9747,0.9748,0.9745,0.9742,0.9744,0.975,0.975,0.975,0.975,0.975,0.975,0.975,0.975,0.975,0.975,0.9748,0.975,0.975,0.975
ISONE,4/9/2000,2000,4,9,100,15,WE,0.975,0.975,0.975,0.9745,0.9745,0.9745,0.9735,0.9701,0.9658,0.9635,0.9679,0.9734,0.9739,0.9746,0.9748,0.975,0.975,0.975,0.975,0.9747,0.975,0.975,0.975,0.9746
ISONE,4/10/2000,2000,4,10,101,15,WD,0.9745,0.9741,0.9721,0.9664,0.9689,0.9605,0.957,0.9193,0.8975,0.7831,0.6662,0.7678,0.7985,0.7992,0.8063,0.8305,0.8482,0.9002,0.9067,0.8311,0.7576,0.6727,0.5319,0.6662
ISONE,4/11/2000,2000,4,11,102,15,WD,0.6846,0.5808,0.4363,0.2527,0.0789,0.0415,0.031,0.0082,0.0116,0.0302,0.0283,0.0385,0.0456,0.0174,0.007,0.019,0.1147,0.2024,0.5105,0.8351,0.8923,0.7889,0.5161,0.4361
ISONE,4/12/2000,2000,4,12,103,15,WD,0.5897,0.7556,0.8143,0.9349,0.9702,0.9705,0.9689,0.9684,0.9577,0.7856,0.6706,0.5663,0.5752,0.5279,0.479,0.4114,0.396,0.4455,0.6417,0.7918,0.9235,0.9514,0.9447,0.9051
ISONE,4/13/2000,2000,4,13,104,15,WD,0.8635,0.8175,0.8144,0.7174,0.6434,0.5213,0.4279,0.3517,0.2631,0.282,0.2616,0.181,0.1212,0.0493,0.0154,0.0214,0.0414,0.074,0.1121,0.1343,0.1611,0.1688,0.1849,0.2269
ISONE,4/14/2000,2000,4,14,105,15,WD,0.2721,0.2165,0.1412,0.0945,0.1087,0.1028,0.0886,0.0606,0.058,0.0628,0.1061,0.1597,0.1989,0.2902,0.3393,0.2987,0.2431,0.2673,0.3252,0.405,0.3948,0.4225,0.6244,0.6931
ISONE,4/15/2000,2000,4,15,106,15,WE,0.8399,0.8999,0.8977,0.8943,0.8555,0.8104,0.7863,0.7772,0.7786,0.6679,0.5307,0.4715,0.5313,0.4992,0.5435,0.5864,0.6813,0.8122,0.9387,0.9534,0.9523,0.8823,0.8755,0.926
ISONE,4/16/2000,2000,4,16,107,16,WE,0.9219,0.8856,0.7783,0.6832,0.7304,0.7312,0.6672,0.5825,0.2444,0.2128,0.3376,0.56,0.7079,0.8148,0.7817,0.7589,0.8799,0.8299,0.8102,0.7305,0.6945,0.6415,0.6536,0.6251
ISONE,4/17/2000,2000,4,17,108,16,WD,0.4928,0.4294,0.5721,0.6957,0.7722,0.8199,0.8649,0.7363,0.8029,0.8301,0.8592,0.8019,0.6927,0.6144,0.6918,0.7197,0.633,0.6766,0.7426,0.6999,0.6277,0.5938,0.6708,0.77
ISONE,4/18/2000,2000,4,18,109,16,WD,0.8163,0.8438,0.8179,0.8572,0.8238,0.8651,0.8721,0.9007,0.9463,0.9705,0.9735,0.9713,0.9735,0.9746,0.9744,0.9746,0.9747,0.9747,0.9748,0.9725,0.9721,0.9721,0.9725,0.9738
ISONE,4/19/2000,2000,4,19,110,16,WD,0.9749,0.9745,0.9749,0.975,0.9749,0.9746,0.9742,0.9749,0.9738,0.9744,0.9745,0.9745,0.9744,0.9743,0.974,0.9735,0.9739,0.9735,0.9734,0.9715,0.9721,0.9516,0.9637,0.9537
ISONE,4/20/2000,2000,4,20,111,16,WD,0.959,0.9505,0.9516,0.9578,0.954,0.9375,0.8929,0.8514,0.8834,0.821,0.8026,0.7489,0.7025,0.6112,0.6096,0.5837,0.5814,0.5673,0.567,0.5189,0.4741,0.4408,0.2963,0.1666
ISONE,4/21/2000,2000,4,21,112,16,WD,0.2328,0.1864,0.1356,0.0896,0.1492,0.1578,0.236,0.2771,0.4192,0.3582,0.4037,0.3868,0.554,0.8326,0.8699,0.9283,0.9435,0.9533,0.9649,0.9603,0.9699,0.9728,0.9744,0.9745
ISONE,4/22/2000,2000,4,22,113,16,WE,0.975,0.9748,0.9748,0.9731,0.9702,0.9702,0.9704,0.9672,0.9137,0.874,0.7559,0.5373,0.51,0.4193,0.3819,0.2687,0.316,0.3575,0.3825,0.4447,0.3693,0.4497,0.5399,0.4579
ISONE,4/23/2000,2000,4,23,114,17,WE,0.3365,0.2872,0.2149,0.1904,0.2077,0.1197,0.1121,0.1629,0.1702,0.1875,0.2121,0.2308,0.2608,0.3133,0.3416,0.4583,0.5484,0.5063,0.5959,0.6748,0.6492,0.5551,0.529,0.5478
ISONE,4/24/2000,2000,4,24,115,17,WD,0.5251,0.6765,0.732,0.6895,0.7679,0.7825,0.847,0.8494,0.8777,0.8265,0.8149,0.7544,0.7117,0.569,0.5433,0.5441,0.6201,0.6729,0.6776,0.7306,0.7705,0.7595,0.7311,0.6331
ISONE,4/25/2000,2000,4,25,116,17,WD,0.5235,0.371,0.2624,0.2348,0.2267,0.3042,0.3056,0.3535,0.4824,0.5316,0.6501,0.7475,0.7941,0.9098,0.9344,0.969,0.962,0.973,0.9735,0.9747,0.9747,0.9748,0.9748,0.9748
ISONE,4/26/2000,2000,4,26,117,17,WD,0.9749,0.9745,0.9747,0.9745,0.9745,0.9744,0.9741,0.9746,0.9742,0.9746,0.9744,0.9744,0.9744,0.9734,0.9718,0.9725,0.9713,0.9685,0.963,0.9469,0.9205,0.8575,0.8138,0.5961
ISONE,4/27/2000,2000,4,27,118,17,WD,0.5822,0.5398,0.4478,0.3404,0.3212,0.2613,0.2436,0.2514,0.2558,0.2403,0.1724,0.1331,0.069,0.0486,0.0279,0.037,0.0488,0.0551,0.0334,0.0419,0.0433,0.0447,0.0539,0.0638
ISONE,4/28/2000,2000,4,28,119,17,WD,0.0611,0.0628,0.0565,0.0404,0.0521,0.0752,0.1161,0.1233,0.133,0.139,0.1458,0.1658,0.1587,0.1534,0.1966,0.2647,0.2255,0.2238,0.1959,0.191,0.1905,0.1563,0.1073,0.0805
ISONE,4/29/2000,2000,4,29,120,17,WE,0.0546,0.0731,0.1809,0.193,0.2927,0.303,0.3982,0.5288,0.5785,0.6398,0.6945,0.7281,0.7355,0.7183,0.6118,0.612,0.6017,0.5687,0.4984,0.3954,0.3673,0.2187,0.1724,0.1044
ISONE,4/30/2000,2000,4,30,121,18,WE,0.1066,0.1333,0.1708,0.3231,0.4229,0.612,0.6425,0.691,0.7119,0.7695,0.7406,0.5953,0.3728,0.3647,0.3187,0.1865,0.1379,0.1051,0.1094,0.1651,0.1987,0.3333,0.379,0.5769
ISONE,5/1/2000,2000,5,1,122,18,WD,0.487,0.3794,0.3089,0.2828,0.1458,0.087,0.0656,0.0724,0.1067,0.1265,0.1586,0.2314,0.3253,0.4565,0.7753,0.8842,0.9401,0.9535,0.968,0.9719,0.9744,0.9709,0.9732,0.974
ISONE,5/2/2000,2000,5,2,123,18,WD,0.9731,0.9736,0.9695,0.9703,0.9664,0.9445,0.9346,0.905,0.8672,0.8637,0.5969,0.6725,0.6452,0.6429,0.5501,0.5356,0.2932,0.137,0.064,0.0481,0.0829,0.4859,0.7534,0.7228
ISONE,5/3/2000,2000,5,3,124,18,WD,0.454,0.3581,0.3006,0.1853,0.2022,0.1428,0.1579,0.1016,0.0703,0.0377,0.0303,0.0159,0.0292,0.0311,0.029,0.0614,0.0915,0.0952,0.1208,0.1332,0.112,0.1312,0.173,0.163
ISONE,5/4/2000,2000,5,4,125,18,WD,0.1752,0.1363,0.0931,0.08,0.0947,0.084,0.0953,0.0904,0.1,0.09,0.135,0.1959,0.3228,0.3546,0.4062,0.3855,0.3787,0.4007,0.4152,0.3582,0.4555,0.5087,0.6227,0.7138
ISONE,5/5/2000,2000,5,5,126,18,WD,0.8214,0.8876,0.8853,0.9581,0.9707,0.9708,0.9709,0.9736,0.9669,0.9579,0.9544,0.9475,0.9135,0.9076,0.9546,0.9683,0.9709,0.9644,0.954,0.883,0.7939,0.7068,0.5416,0.3755
ISONE,5/6/2000,2000,5,6,127,18,WE,0.2221,0.1901,0.2271,0.2363,0.2526,0.4772,0.4635,0.3922,0.2444,0.0765,0.0468,0.0184,0.0187,0.0065,0.0118,0.0085,0.0177,0.0118,0.0238,0.0489,0.0903,0.1116,0.2477,0.251
ISONE,5/7/2000,2000,5,7,128,19,WE,0.2857,0.3355,0.4732,0.4538,0.6036,0.5693,0.4477,0.3203,0.2719,0.2722,0.301,0.4462,0.5065,0.6884,0.8578,0.952,0.9528,0.9732,0.9748,0.975,0.9748,0.9715,0.9698,0.9737
ISONE,5/8/2000,2000,5,8,129,19,WD,0.9624,0.7745,0.8522,0.7107,0.6089,0.6931,0.5035,0.5437,0.41,0.2912,0.1525,0.161,0.0978,0.058,0.0519,0.0487,0.0757,0.1119,0.303,0.5007,0.522,0.5389,0.5212,0.4861
ISONE,5/9/2000,2000,5,9,130,19,WD,0.4408,0.6058,0.5694,0.772,0.7235,0.7059,0.7507,0.9157,0.9358,0.8361,0.7915,0.7187,0.7025,0.8044,0.9232,0.9739,0.975,0.9747,0.9747,0.9749,0.975,0.9749,0.9712,0.8846
ISONE,5/10/2000,2000,5,10,131,19,WD,0.6338,0.3853,0.2215,0.0985,0.0701,0.0442,0.0557,0.0871,0.0718,0.0964,0.0814,0.0956,0.1368,0.1536,0.2633,0.3382,0.4725,0.7489,0.8256,0.933,0.9571,0.9318,0.8949,0.9108
ISONE,5/11/2000,2000,5,11,132,19,WD,0.8225,0.905,0.9176,0.9168,0.8233,0.7344,0.6976,0.8317,0.8786,0.7984,0.6271,0.4402,0.5723,0.6054,0.6987,0.6147,0.5695,0.4646,0.3517,0.3684,0.3457,0.378,0.1804,0.1331
ISONE,5/12/2000,2000,5,12,133,19,WD,0.1173,0.1316,0.1401,0.0986,0.0865,0.0784,0.0566,0.0505,0.0208,0.0145,0.0128,0.0184,0.0218,0.0392,0.0795,0.1094,0.1488,0.1295,0.1524,0.1072,0.1885,0.2139,0.2683,0.2873
ISONE,5/13/2000,2000,5,13,134,19,WE,0.4329,0.3388,0.3698,0.3708,0.4116,0.4569,0.5718,0.541,0.6297,0.5428,0.586,0.5451,0.4948,0.4372,0.4476,0.4249,0.4689,0.5319,0.6179,0.5802,0.6308,0.671,0.7569,0.6171
ISONE,5/14/2000,2000,5,14,135,20,WE,0.6568,0.5426,0.5274,0.3658,0.5379,0.6129,0.5943,0.4793,0.477,0.3323,0.2677,0.164,0.1163,0.1345,0.2338,0.3603,0.4589,0.6561,0.8083,0.854,0.8846,0.8625,0.785,0.763
ISONE,5/15/2000,2000,5,15,136,20,WD,0.6319,0.7606,0.8836,0.8917,0.8392,0.6708,0.555,0.3527,0.3149,0.1788,0.1667,0.1061,0.0911,0.1499,0.3398,0.6704,0.7901,0.7931,0.8026,0.7855,0.8066,0.827,0.8007,0.6433
ISONE,5/16/2000,2000,5,16,137,20,WD,0.4526,0.3728,0.2758,0.3177,0.284,0.2643,0.2681,0.2086,0.1811,0.1382,0.1209,0.0704,0.075,0.1563,0.2888,0.4522,0.6531,0.6553,0.6455,0.714,0.8358,0.8337,0.8045,0.7923
ISONE,5/17/2000,2000,5,17,138,20,WD,0.7428,0.6656,0.6915,0.7158,0.5971,0.5008,0.4152,0.3001,0.1854,0.151,0.0505,0.0329,0.0256,0.0788,0.1878,0.3488,0.4953,0.5774,0.6416,0.5964,0.6554,0.7354,0.7752,0.8403
ISONE,5/18/2000,2000,5,18,139,20,WD,0.8503,0.9281,0.9188,0.9277,0.9527,0.9678,0.9715,0.9693,0.9726,0.9745,0.9748,0.975,0.975,0.975,0.975,0.9728,0.9728,0.9732,0.9692,0.9679,0.9741,0.975,0.975,0.975
ISONE,5/19/2000,2000,5,19,140,20,WD,0.9749,0.9723,0.9686,0.9458,0.7173,0.8064,0.919,0.9664,0.9727,0.9741,0.9736,0.9686,0.9697,0.966,0.9709,0.9699,0.9684,0.9614,0.9661,0.966,0.9644,0.9503,0.9259,0.9401
ISONE,5/20/2000,2000,5,20,141,20,WE,0.9077,0.8008,0.7855,0.753,0.6961,0.7482,0.7548,0.5946,0.6132,0.5549,0.5753,0.5319,0.4501,0.4453,0.4979,0.5624,0.5237,0.4284,0.4118,0.3393,0.3757,0.3521,0.2493,0.195
ISONE,5/21/2000,2000,5,21,142,21,WE,0.1886,0.1957,0.1814,0.1195,0.1189,0.0623,0.078,0.097,0.1262,0.1694,0.1336,0.2406,0.1969,0.2392,0.27,0.2195,0.174,0.12,0.0996,0.1475,0.3341,0.3996,0.3225,0.2152
ISONE,5/22/2000,2000,5,22,143,21,WD,0.2387,0.1958,0.1523,0.1569,0.154,0.1559,0.1326,0.1206,0.0543,0.0812,0.0994,0.119,0.1339,0.2604,0.2698,0.367,0.27,0.2929,0.3834,0.523,0.4638,0.3541,0.4276,0.4299
ISONE,5/23/2000,2000,5,23,144,21,WD,0.5878,0.6697,0.7362,0.7289,0.6262,0.5663,0.5223,0.5849,0.4543,0.3002,0.2291,0.1,0.027,0.05,0.0559,0.0749,0.0912,0.1531,0.1826,0.201,0.21,0.2469,0.1959,0.1912
ISONE,5/24/2000,2000,5,24,145,21,WD,0.1968,0.244,0.325,0.5844,0.633,0.7755,0.905,0.9721,0.9746,0.9699,0.9666,0.8895,0.8178,0.7382,0.7696,0.6775,0.6035,0.5411,0.4738,0.4503,0.5476,0.689,0.7152,0.6263
ISONE,5/25/2000,2000,5,25,146,21,WD,0.7375,0.692,0.6062,0.5805,0.7772,0.8191,0.9137,0.8301,0.8674,0.8836,0.8042,0.807,0.8894,0.8819,0.9065,0.9021,0.8301,0.7088,0.6268,0.5499,0.6541,0.7529,0.7434,0.5968
ISONE,5/26/2000,2000,5,26,147,21,WD,0.4717,0.4294,0.3833,0.3453,0.4548,0.605,0.5539,0.4725,0.3682,0.305,0.2733,0.3422,0.5563,0.7507,0.8081,0.8356,0.8534,0.8536,0.9255,0.9325,0.9098,0.9378,0.8266,0.8831
ISONE,5/27/2000,2000,5,27,148,21,WE,0.7417,0.559,0.5199,0.2749,0.2563,0.3046,0.3276,0.3213,0.2239,0.1817,0.1565,0.1535,0.1656,0.2535,0.501,0.776,0.8368,0.8782,0.9379,0.9288,0.9197,0.8754,0.8028,0.6165
ISONE,5/28/2000,2000,5,28,149,22,WE,0.392,0.5364,0.7496,0.8583,0.7815,0.7478,0.5891,0.3917,0.269,0.3112,0.3194,0.2453,0.2396,0.3505,0.3376,0.476,0.5224,0.505,0.6073,0.6938,0.6802,0.6743,0.6046,0.6005
ISONE,5/29/2000,2000,5,29,150,22,WD,0.5876,0.5872,0.6134,0.4897,0.5366,0.6852,0.7521,0.7049,0.7816,0.7113,0.7962,0.774,0.7588,0.7709,0.7259,0.7341,0.8106,0.8005,0.8302,0.7736,0.6518,0.5656,0.5986,0.586
ISONE,5/30/2000,2000,5,30,151,22,WD,0.6066,0.5942,0.6063,0.5711,0.4474,0.4884,0.4815,0.553,0.5268,0.4817,0.4878,0.5567,0.4896,0.5223,0.5311,0.4688,0.4031,0.426,0.4488,0.4984,0.5276,0.5618,0.5543,0.4144
ISONE,5/31/2000,2000,5,31,152,22,WD,0.3414,0.3001,0.3184,0.2564,0.2006,0.1454,0.0941,0.0613,0.0564,0.0606,0.0551,0.0296,0.0101,0.0111,0.0145,0.0079,0.0086,0.0093,0.0129,0.0295,0.0552,0.0702,0.0999,0.1677
ISONE,6/1/2000,2000,6,1,153,22,WD,0.2309,0.217,0.3286,0.3315,0.3154,0.248,0.3495,0.3442,0.3953,0.4245,0.4039,0.4345,0.5025,0.6183,0.6338,0.7052,0.7722,0.8047,0.7196,0.7059,0.7479,0.7448,0.6286,0.5726
ISONE,6/2/2000,2000,6,2,154,22,WD,0.5639,0.3662,0.302,0.1578,0.1064,0.0685,0.0427,0.0459,0.0372,0.0631,0.1697,0.3173,0.519,0.8842,0.9608,0.9743,0.9744,0.9749,0.975,0.975,0.975,0.975,0.975,0.9717
ISONE,6/3/2000,2000,6,3,155,22,WE,0.9396,0.9352,0.8852,0.8348,0.8027,0.7186,0.7171,0.6824,0.6448,0.5788,0.4307,0.367,0.2362,0.1877,0.1877,0.1505,0.1757,0.1662,0.1448,0.0922,0.048,0.0555,0.0682,0.0966
ISONE,6/4/2000,2000,6,4,156,23,WE,0.0983,0.1088,0.1581,0.1396,0.1609,0.1562,0.1709,0.1363,0.057,0.045,0.0368,0.0482,0.0206,0.0076,0.0082,0.0136,0.013,0.0202,0.036,0.1043,0.1637,0.2097,0.1814,0.1317
ISONE,6/5/2000,2000,6,5,157,23,WD,0.0388,0.0088,0.0069,0.0244,0.0398,0.0765,0.0623,0.0881,0.0833,0.1102,0.1308,0.1286,0.2097,0.2694,0.4043,0.3901,0.3664,0.4501,0.587,0.5919,0.7778,0.8482,0.9095,0.8714
ISONE,6/6/2000,2000,6,6,158,23,WD,0.9017,0.8769,0.9232,0.9227,0.9631,0.9719,0.9729,0.9744,0.9739,0.9743,0.9748,0.9748,0.9743,0.9741,0.9741,0.9742,0.9746,0.9746,0.9746,0.9746,0.9744,0.9744,0.9742,0.9744
ISONE,6/7/2000,2000,6,7,159,23,WD,0.9746,0.9744,0.9744,0.9741,0.9742,0.9739,0.9741,0.9741,0.9715,0.9718,0.964,0.949,0.8467,0.6459,0.2248,0.0898,0.0718,0.1078,0.1736,0.151,0.0883,0.0719,0.1239,0.2355
ISONE,6/8/2000,2000,6,8,160,23,WD,0.3787,0.4708,0.5063,0.4952,0.4022,0.4494,0.4342,0.3506,0.4329,0.5238,0.594,0.6454,0.8399,0.8896,0.9305,0.9637,0.971,0.9723,0.9709,0.9705,0.9744,0.974,0.9747,0.975
ISONE,6/9/2000,2000,6,9,161,23,WD,0.975,0.975,0.975,0.975,0.9748,0.9747,0.9748,0.9742,0.9735,0.9676,0.9595,0.9611,0.9182,0.9562,0.9453,0.9165,0.8429,0.8588,0.9257,0.9499,0.9467,0.9064,0.8727,0.8115
ISONE,6/10/2000,2000,6,10,162,23,WE,0.6137,0.5242,0.4349,0.2464,0.1524,0.152,0.1596,0.186,0.342,0.4477,0.6499,0.7376,0.8186,0.8315,0.8913,0.9293,0.9612,0.9586,0.975,0.9745,0.975,0.975,0.975,0.9749
ISONE,6/11/2000,2000,6,11,163,24,WE,0.974,0.9734,0.9712,0.969,0.9691,0.9657,0.9624,0.9539,0.9442,0.9353,0.9269,0.9029,0.8154,0.739,0.4804,0.314,0.219,0.1153,0.2641,0.2779,0.2656,0.3007,0.4277,0.3309
ISONE,6/12/2000,2000,6,12,164,24,WD,0.3878,0.3889,0.2142,0.111,0.126,0.1536,0.3685,0.5021,0.5946,0.6272,0.6488,0.6137,0.5722,0.6374,0.6524,0.623,0.5183,0.4787,0.4149,0.5482,0.5376,0.5464,0.5919,0.5688
ISONE,6/13/2000,2000,6,13,165,24,WD,0.5326,0.5982,0.6257,0.6363,0.6184,0.6737,0.704,0.6575,0.6302,0.5736,0.6586,0.6147,0.5604,0.5726,0.5303,0.5251,0.4855,0.4589,0.5107,0.5127,0.5059,0.4715,0.4972,0.4961
ISONE,6/14/2000,2000,6,14,166,24,WD,0.5264,0.5442,0.5342,0.6012,0.4447,0.3143,0.2565,0.2163,0.2148,0.2054,0.2483,0.3087,0.3091,0.3862,0.3753,0.3639,0.3508,0.2904,0.2674,0.2167,0.1545,0.1198,0.0956,0.1257
ISONE,6/15/2000,2000,6,15,167,24,WD,0.1288,0.1323,0.1255,0.1147,0.1663,0.2263,0.3027,0.4092,0.6409,0.7318,0.8298,0.8861,0.8643,0.7771,0.6582,0.6035,0.5464,0.6135,0.7905,0.8952,0.8988,0.9235,0.9417,0.9635
ISONE,6/16/2000,2000,6,16,168,24,WD,0.9739,0.9743,0.9744,0.9744,0.9743,0.9749,0.9721,0.9702,0.9093,0.7561,0.6213,0.7273,0.8207,0.9431,0.9663,0.9671,0.9734,0.975,0.975,0.975,0.9748,0.9749,0.9749,0.975
ISONE,6/17/2000,2000,6,17,169,24,WE,0.9748,0.9746,0.9747,0.9744,0.9748,0.9743,0.9688,0.9675,0.9565,0.9452,0.9694,0.9704,0.964,0.9726,0.9703,0.9741,0.9739,0.9739,0.9652,0.9641,0.9504,0.9271,0.8437,0.699
ISONE,6/18/2000,2000,6,18,170,25,WE,0.5395,0.434,0.3545,0.2605,0.2524,0.3285,0.2357,0.464,0.3905,0.4088,0.4277,0.5097,0.3655,0.3309,0.309,0.2755,0.3188,0.4802,0.6601,0.5213,0.4598,0.365,0.6108,0.6263
ISONE,6/19/2000,2000,6,19,171,25,WD,0.4481,0.2778,0.3302,0.2773,0.2685,0.1951,0.3656,0.4764,0.5293,0.5063,0.5388,0.579,0.5298,0.4446,0.358,0.3048,0.2303,0.1419,0.1281,0.1058,0.0734,0.0391,0.0189,0.0242
ISONE,6/20/2000,2000,6,20,172,25,WD,0.0562,0.1143,0.1861,0.2873,0.3125,0.305,0.3553,0.4651,0.3939,0.2975,0.2128,0.1973,0.1299,0.0729,0.0423,0.0117,0.0141,0.0311,0.0534,0.0482,0.0742,0.096,0.1985,0.2712
ISONE,6/21/2000,2000,6,21,173,25,WD,0.2381,0.3272,0.353,0.341,0.404,0.5417,0.6259,0.7102,0.7257,0.9022,0.9295,0.932,0.9276,0.9273,0.9329,0.9105,0.9644,0.968,0.9734,0.9739,0.9734,0.9745,0.975,0.975
ISONE,6/22/2000,2000,6,22,174,25,WD,0.975,0.9749,0.975,0.975,0.9748,0.9748,0.9741,0.9717,0.9667,0.9661,0.937,0.8518,0.7804,0.8459,0.8344,0.8217,0.8932,0.9366,0.9477,0.9668,0.9666,0.9734,0.9732,0.9694
ISONE,6/23/2000,2000,6,23,175,25,WD,0.97,0.9643,0.9567,0.8091,0.3791,0.4909,0.4741,0.3605,0.3106,0.2152,0.1672,0.1053,0.1058,0.1197,0.1604,0.2426,0.3243,0.3923,0.5221,0.5973,0.6357,0.619,0.6161,0.6093
ISONE,6/24/2000,2000,6,24,176,25,WE,0.4935,0.3953,0.3316,0.3355,0.2025,0.1238,0.087,0.0702,0.043,0.0287,0.005,0.0043,0.0085,0.0129,0.0368,0.1254,0.1842,0.2572,0.3077,0.4055,0.3765,0.4103,0.4433,0.3596
ISONE,6/25/2000,2000,6,25,177,26,WE,0.3718,0.4649,0.3838,0.4724,0.6274,0.7176,0.7608,0.8251,0.8599,0.9056,0.9167,0.9154,0.9523,0.9635,0.9699,0.9729,0.9739,0.9721,0.9708,0.9652,0.9491,0.9245,0.8683,0.8465
ISONE,6/26/2000,2000,6,26,178,26,WD,0.9207,0.8949,0.8186,0.7777,0.7539,0.788,0.6874,0.7095,0.5424,0.4276,0.2792,0.2943,0.293,0.3615,0.3895,0.3869,0.4013,0.4431,0.5524,0.6596,0.6485,0.7371,0.7406,0.7253
ISONE,6/27/2000,2000,6,27,179,26,WD,0.8182,0.8262,0.8707,0.9315,0.9571,0.9628,0.9579,0.9439,0.9069,0.8788,0.8112,0.8652,0.878,0.8843,0.9256,0.9437,0.9419,0.943,0.903,0.9038,0.9253,0.8858,0.9085,0.8388
ISONE,6/28/2000,2000,6,28,180,26,WD,0.6917,0.5785,0.3517,0.2187,0.184,0.1556,0.0946,0.0857,0.0651,0.0933,0.059,0.0258,0.0093,0.0023,0.0078,0.0058,0.0141,0.0464,0.0602,0.0583,0.0411,0.047,0.0687,0.0731
ISONE,6/29/2000,2000,6,29,181,26,WD,0.0688,0.0454,0.0535,0.0345,0.0367,0.0481,0.0264,0.0295,0.0455,0.0525,0.0419,0.0364,0.0327,0.0365,0.0422,0.0499,0.0452,0.0544,0.0608,0.036,0.0426,0.0366,0.0442,0.0646
ISONE,6/30/2000,2000,6,30,182,26,WD,0.1289,0.1182,0.0835,0.0691,0.0505,0.056,0.0511,0.0506,0.021,0.0304,0.0421,0.0494,0.0628,0.0721,0.16,0.2276,0.3183,0.4134,0.4547,0.5618,0.6261,0.6645,0.6904,0.6039
ISONE,7/1/2000,2000,7,1,183,26,WE,0.4398,0.3566,0.2899,0.2511,0.2576,0.2291,0.1501,0.157,0.1574,0.1046,0.0551,0.0329,0.0164,0.0012,0.0075,0.0177,0.0403,0.0352,0.0472,0.0429,0.0297,0.0221,0.0235,0.0183
ISONE,7/2/2000,2000,7,2,184,27,WE,0.0243,0.024,0.0279,0.0279,0.0377,0.0273,0.0431,0.0744,0.0755,0.0625,0.0809,0.1012,0.0908,0.0778,0.0937,0.1696,0.232,0.2897,0.3446,0.2928,0.3288,0.3377,0.4493,0.3752
ISONE,7/3/2000,2000,7,3,185,27,WD,0.3732,0.4433,0.4604,0.492,0.4568,0.5297,0.5454,0.6114,0.5948,0.6968,0.7479,0.748,0.7826,0.7566,0.7732,0.8309,0.787,0.8508,0.874,0.9199,0.9109,0.9098,0.9181,0.9328
ISONE,7/4/2000,2000,7,4,186,27,WD,0.9513,0.9535,0.9389,0.9386,0.9357,0.9298,0.8853,0.8002,0.7075,0.584,0.4525,0.3009,0.1919,0.1783,0.2057,0.1723,0.2365,0.3986,0.4645,0.5987,0.7139,0.7216,0.7124,0.6285
ISONE,7/5/2000,2000,7,5,187,27,WD,0.5878,0.6418,0.6097,0.5379,0.5228,0.4033,0.3378,0.2446,0.1638,0.1687,0.1428,0.1218,0.0972,0.1715,0.251,0.341,0.3814,0.4935,0.3701,0.402,0.3455,0.2426,0.1687,0.1428
ISONE,7/6/2000,2000,7,6,188,27,WD,0.1063,0.0936,0.1005,0.0806,0.1152,0.1838,0.3753,0.3845,0.3994,0.253,0.1849,0.1529,0.1243,0.1082,0.1017,0.0953,0.0873,0.1111,0.1301,0.143,0.1061,0.0752,0.072,0.0596
ISONE,7/7/2000,2000,7,7,189,27,WD,0.0408,0.0145,0.025,0.0272,0.0749,0.0939,0.2324,0.2607,0.2413,0.0965,0.0605,0.0591,0.0449,0.0285,0.0198,0.0271,0.0332,0.0415,0.054,0.0358,0.026,0.0472,0.077,0.1285
ISONE,7/8/2000,2000,7,8,190,27,WE,0.1689,0.3737,0.4374,0.5122,0.5303,0.534,0.5588,0.468,0.3189,0.3409,0.3455,0.2665,0.1969,0.0588,0.03,0.0378,0.1024,0.2027,0.4387,0.5633,0.6319,0.6545,0.7068,0.6376
ISONE,7/9/2000,2000,7,9,191,28,WE,0.5699,0.4961,0.3418,0.2478,0.2093,0.1665,0.1043,0.0548,0.0699,0.0575,0.0823,0.1733,0.2309,0.3373,0.5289,0.6642,0.7652,0.8554,0.932,0.9411,0.9721,0.9734,0.9736,0.975
ISONE,7/10/2000,2000,7,10,192,28,WD,0.975,0.9745,0.9744,0.974,0.9744,0.9742,0.9732,0.9639,0.9433,0.9092,0.9172,0.926,0.9176,0.892,0.8463,0.8062,0.8064,0.7861,0.8023,0.7384,0.7851,0.6849,0.7443,0.6969
ISONE,7/11/2000,2000,7,11,193,28,WD,0.653,0.5826,0.5541,0.5018,0.4731,0.3972,0.33,0.1811,0.168,0.1261,0.1172,0.0719,0.0667,0.0751,0.1032,0.2126,0.307,0.4,0.5428,0.611,0.7753,0.5964,0.4288,0.4953
ISONE,7/12/2000,2000,7,12,194,28,WD,0.6503,0.5049,0.5178,0.4369,0.3979,0.3915,0.2672,0.1769,0.1619,0.1513,0.1406,0.1097,0.0585,0.045,0.0676,0.1044,0.1786,0.2651,0.3468,0.3986,0.4549,0.5167,0.5882,0.6202
ISONE,7/13/2000,2000,7,13,195,28,WD,0.6577,0.6634,0.5874,0.4282,0.2556,0.164,0.0728,0.1014,0.0544,0.0572,0.0185,0.0093,0.0266,0.0246,0.0499,0.0816,0.1449,0.1982,0.3567,0.4326,0.4495,0.4616,0.5631,0.5286
ISONE,7/14/2000,2000,7,14,196,28,WD,0.5,0.48,0.4606,0.3851,0.3036,0.3365,0.3777,0.3227,0.3973,0.2989,0.2594,0.2782,0.2962,0.3636,0.3846,0.5289,0.6153,0.6565,0.6282,0.6681,0.5948,0.542,0.6345,0.6264
ISONE,7/15/2000,2000,7,15,197,28,WE,0.6708,0.6755,0.6803,0.7628,0.7722,0.8347,0.8231,0.8729,0.9219,0.91,0.9254,0.9572,0.9571,0.958,0.9651,0.9647,0.9672,0.9653,0.9651,0.9683,0.9694,0.9627,0.9593,0.9717
ISONE,7/16/2000,2000,7,16,198,29,WE,0.9662,0.9664,0.9426,0.9149,0.8827,0.8352,0.7717,0.6701,0.601,0.5841,0.5404,0.298,0.3183,0.2196,0.2299,0.2274,0.1235,0.1132,0.1088,0.0661,0.0438,0.0503,0.0951,0.0547
ISONE,7/17/2000,2000,7,17,199,29,WD,0.0459,0.0265,0.0206,0.0153,0.0165,0.0266,0.0358,0.0423,0.0701,0.064,0.045,0.0254,0.0257,0.0148,0.0228,0.024,0.019,0.0167,0.0153,0.0247,0.027,0.0146,0.0132,0.0104
ISONE,7/18/2000,2000,7,18,200,29,WD,0.0222,0.0286,0.0195,0.0269,0.0525,0.0921,0.1508,0.1905,0.2492,0.2982,0.3713,0.523,0.6715,0.7515,0.836,0.9108,0.9525,0.9616,0.959,0.9508,0.9235,0.8356,0.7906,0.7412
ISONE,7/19/2000,2000,7,19,201,29,WD,0.5723,0.3453,0.3081,0.2397,0.2121,0.1525,0.168,0.1426,0.1125,0.0758,0.0525,0.049,0.0449,0.0486,0.0415,0.0714,0.107,0.0819,0.0776,0.0704,0.0619,0.0648,0.0285,0.0346
ISONE,7/20/2000,2000,7,20,202,29,WD,0.0355,0.0304,0.0236,0.0228,0.0245,0.0233,0.0313,0.0517,0.1292,0.2396,0.4437,0.4658,0.4568,0.5141,0.4271,0.4298,0.5257,0.4469,0.4786,0.4489,0.3299,0.281,0.2175,0.1485
ISONE,7/21/2000,2000,7,21,203,29,WD,0.1111,0.102,0.0826,0.0872,0.1556,0.1648,0.149,0.1685,0.1548,0.1136,0.0898,0.0878,0.0975,0.1426,0.2218,0.2546,0.3115,0.4404,0.5554,0.6334,0.657,0.6699,0.6805,0.7388
ISONE,7/22/2000,2000,7,22,204,29,WE,0.7147,0.7375,0.6503,0.5663,0.4258,0.4094,0.4526,0.5237,0.5383,0.5513,0.4669,0.4891,0.3916,0.4002,0.4531,0.3832,0.3155,0.2903,0.4386,0.4396,0.5031,0.4877,0.4935,0.594
ISONE,7/23/2000,2000,7,23,205,30,WE,0.5856,0.5195,0.5852,0.5132,0.4435,0.3729,0.3636,0.2332,0.1716,0.1051,0.0532,0.0305,0.0271,0.0168,0.0289,0.0355,0.0771,0.1419,0.1618,0.2082,0.2426,0.2345,0.2065,0.1291
ISONE,7/24/2000,2000,7,24,206,30,WD,0.1015,0.0591,0.0323,0.0477,0.0752,0.1194,0.1396,0.2428,0.3064,0.2947,0.2408,0.221,0.1408,0.1253,0.0921,0.108,0.1458,0.1514,0.2032,0.1616,0.1832,0.1418,0.1892,0.1863
ISONE,7/25/2000,2000,7,25,207,30,WD,0.1679,0.1586,0.1299,0.1785,0.2553,0.2563,0.2804,0.3978,0.4709,0.5778,0.5386,0.5419,0.5124,0.5721,0.5389,0.6069,0.5738,0.5962,0.5767,0.5058,0.3946,0.3744,0.3397,0.4052
ISONE,7/26/2000,2000,7,26,208,30,WD,0.3099,0.3188,0.3962,0.5025,0.5442,0.4261,0.4301,0.421,0.442,0.4392,0.4311,0.5656,0.6128,0.5379,0.503,0.5044,0.4508,0.4786,0.4266,0.4095,0.5291,0.5593,0.5851,0.6243
ISONE,7/27/2000,2000,7,27,209,30,WD,0.6803,0.7302,0.8485,0.6671,0.7051,0.7623,0.8353,0.838,0.8144,0.8391,0.7831,0.8361,0.9229,0.9034,0.8716,0.8125,0.8054,0.7051,0.5347,0.6433,0.6345,0.6722,0.6369,0.6322
ISONE,7/28/2000,2000,7,28,210,30,WD,0.639,0.5376,0.4348,0.2822,0.1697,0.1226,0.1152,0.207,0.2752,0.2976,0.4122,0.4855,0.4884,0.3804,0.3347,0.3633,0.3651,0.3596,0.3702,0.3949,0.3395,0.3122,0.2686,0.2289
ISONE,7/29/2000,2000,7,29,211,30,WE,0.2532,0.2627,0.2794,0.3871,0.4234,0.5029,0.4739,0.4431,0.4686,0.4286,0.4185,0.3969,0.3021,0.2888,0.2361,0.1162,0.0698,0.0568,0.0444,0.0327,0.0254,0.0246,0.0194,0.0141
ISONE,7/30/2000,2000,7,30,212,31,WE,0.0104,0.0178,0.0264,0.0206,0.01,0.011,0.0081,0.009,0.0087,0.0073,0.0139,0.0158,0.0121,0.0062,0.0029,0.0042,0.0097,0.0205,0.0169,0.0172,0.0226,0.0352,0.0588,0.0657
ISONE,7/31/2000,2000,7,31,213,31,WD,0.0738,0.0923,0.1166,0.1369,0.154,0.1585,0.1586,0.1849,0.2254,0.2546,0.3588,0.3882,0.455,0.5379,0.4538,0.4358,0.4847,0.4818,0.4248,0.4502,0.4997,0.4748,0.4151,0.3716
ISONE,8/1/2000,2000,8,1,214,31,WD,0.3707,0.3117,0.2396,0.2053,0.1296,0.1308,0.1682,0.2134,0.2547,0.3877,0.3564,0.3066,0.3003,0.254,0.2408,0.1181,0.1342,0.1445,0.1312,0.1322,0.2419,0.2863,0.2951,0.3061
ISONE,8/2/2000,2000,8,2,215,31,WD,0.3073,0.3733,0.5161,0.6634,0.6813,0.748,0.7396,0.6407,0.5109,0.4959,0.5259,0.6445,0.7548,0.7523,0.8261,0.8658,0.7992,0.8344,0.9197,0.9352,0.8862,0.8988,0.9433,0.9385
ISONE,8/3/2000,2000,8,3,216,31,WD,0.9397,0.9285,0.9378,0.9245,0.9003,0.8958,0.903,0.7672,0.835,0.888,0.873,0.8305,0.9158,0.9212,0.9051,0.9425,0.9444,0.9436,0.9517,0.9516,0.9426,0.9088,0.9208,0.8953
ISONE,8/4/2000,2000,8,4,217,31,WD,0.8555,0.8676,0.7921,0.6537,0.6842,0.6351,0.5991,0.502,0.3805,0.2252,0.1331,0.1158,0.0657,0.0654,0.0494,0.0338,0.0251,0.0202,0.0323,0.0346,0.0515,0.0566,0.0771,0.0657
ISONE,8/5/2000,2000,8,5,218,31,WE,0.0585,0.1139,0.1206,0.1176,0.1126,0.1315,0.1233,0.229,0.2966,0.2561,0.2467,0.2524,0.2003,0.2442,0.1729,0.1353,0.0678,0.0506,0.0508,0.0474,0.0503,0.055,0.102,0.1116
ISONE,8/6/2000,2000,8,6,219,32,WE,0.1712,0.2312,0.2819,0.2853,0.2408,0.2729,0.232,0.1829,0.1453,0.1248,0.0969,0.1452,0.2115,0.1995,0.239,0.2831,0.2924,0.4038,0.4244,0.5926,0.6581,0.6466,0.7303,0.827
ISONE,8/7/2000,2000,8,7,220,32,WD,0.8959,0.923,0.9447,0.9621,0.9711,0.9728,0.9708,0.9717,0.9696,0.9707,0.9641,0.9655,0.9385,0.9382,0.9578,0.9684,0.9726,0.9732,0.9705,0.97,0.9542,0.9365,0.9437,0.9303
ISONE,8/8/2000,2000,8,8,221,32,WD,0.9069,0.9416,0.9547,0.9599,0.9325,0.9143,0.8249,0.7066,0.6052,0.4741,0.4131,0.4077,0.4157,0.4553,0.5978,0.7172,0.7684,0.7811,0.7834,0.8192,0.8456,0.7807,0.7162,0.6452
ISONE,8/9/2000,2000,8,9,222,32,WD,0.5735,0.5879,0.4814,0.3815,0.2551,0.2568,0.4097,0.4576,0.482,0.6293,0.7788,0.7734,0.7206,0.7521,0.8918,0.9673,0.9727,0.9729,0.9728,0.9735,0.9711,0.9741,0.9739,0.9742
ISONE,8/10/2000,2000,8,10,223,32,WD,0.9735,0.9719,0.9655,0.9223,0.5999,0.4611,0.4389,0.3033,0.3589,0.3235,0.1912,0.0916,0.0521,0.0573,0.049,0.0238,0.028,0.0363,0.0608,0.1338,0.1285,0.1019,0.0633,0.0313
ISONE,8/11/2000,2000,8,11,224,32,WD,0.0188,0.0258,0.0472,0.1231,0.2333,0.2877,0.4108,0.3366,0.3036,0.2881,0.2764,0.3136,0.4029,0.3842,0.3753,0.4124,0.4345,0.5457,0.6156,0.7017,0.629,0.6475,0.6664,0.7314
ISONE,8/12/2000,2000,8,12,225,32,WE,0.7738,0.6908,0.8089,0.863,0.901,0.9352,0.9113,0.9247,0.9314,0.9485,0.9076,0.9121,0.9443,0.901,0.9071,0.9383,0.9368,0.9293,0.9206,0.91,0.9024,0.9034,0.8398,0.8622
ISONE,8/13/2000,2000,8,13,226,33,WE,0.8107,0.9133,0.9331,0.9255,0.9266,0.9329,0.9561,0.9513,0.9392,0.9302,0.8977,0.8894,0.8227,0.7719,0.8344,0.8586,0.8907,0.8868,0.8607,0.9104,0.9126,0.9429,0.9477,0.9494
ISONE,8/14/2000,2000,8,14,227,33,WD,0.943,0.9544,0.9571,0.9431,0.9343,0.9278,0.926,0.8524,0.8234,0.7246,0.6017,0.6299,0.5074,0.4685,0.3817,0.3378,0.3102,0.248,0.2012,0.2576,0.2838,0.2582,0.2361,0.1431
ISONE,8/15/2000,2000,8,15,228,33,WD,0.1634,0.1556,0.1866,0.2021,0.2099,0.2239,0.1537,0.1679,0.1769,0.2352,0.2321,0.3259,0.3282,0.3329,0.3533,0.3333,0.265,0.2505,0.3029,0.4266,0.4232,0.3501,0.1862,0.1261
ISONE,8/16/2000,2000,8,16,229,33,WD,0.0894,0.0748,0.081,0.0837,0.1578,0.1566,0.2407,0.3284,0.5216,0.6686,0.7321,0.8508,0.9162,0.9286,0.9463,0.8816,0.826,0.8159,0.7207,0.6788,0.7509,0.7567,0.8232,0.7396
ISONE,8/17/2000,2000,8,17,230,33,WD,0.7336,0.7304,0.6695,0.6651,0.6443,0.5636,0.5719,0.4788,0.4776,0.3278,0.2857,0.1792,0.1531,0.1469,0.1341,0.1278,0.1215,0.151,0.1739,0.1567,0.1409,0.1668,0.1933,0.1799
ISONE,8/18/2000,2000,8,18,231,33,WD,0.1564,0.142,0.1023,0.1002,0.0581,0.0413,0.0553,0.0223,0.025,0.0201,0.0184,0.0376,0.0697,0.0819,0.1048,0.1452,0.1516,0.1789,0.1968,0.1453,0.0743,0.0917,0.0955,0.1321
ISONE,8/19/2000,2000,8,19,232,33,WE,0.1797,0.1922,0.251,0.3287,0.2917,0.4313,0.506,0.4996,0.5049,0.6364,0.6151,0.572,0.4908,0.3944,0.2337,0.1731,0.0902,0.0703,0.031,0.0327,0.049,0.0557,0.0937,0.1172
ISONE,8/20/2000,2000,8,20,233,34,WE,0.1542,0.1929,0.321,0.4867,0.4741,0.4583,0.4967,0.5184,0.4432,0.4337,0.4386,0.3984,0.3286,0.2928,0.2214,0.1365,0.124,0.0815,0.1031,0.1029,0.2665,0.317,0.241,0.1969
ISONE,8/21/2000,2000,8,21,234,34,WD,0.181,0.1939,0.3475,0.3605,0.3247,0.4002,0.2693,0.2298,0.2406,0.1884,0.1406,0.0729,0.0311,0.0075,0.0076,0.014,0.0277,0.041,0.0687,0.0974,0.1468,0.146,0.1515,0.1927
ISONE,8/22/2000,2000,8,22,235,34,WD,0.2233,0.2179,0.183,0.2001,0.1625,0.1331,0.0935,0.1093,0.0999,0.1019,0.0539,0.0261,0.0151,0.0047,0.0025,0.0101,0.02,0.0324,0.0412,0.0305,0.028,0.0289,0.0496,0.0847
ISONE,8/23/2000,2000,8,23,236,34,WD,0.1052,0.1285,0.098,0.1069,0.1044,0.0791,0.0895,0.1114,0.1651,0.2218,0.2971,0.321,0.3591,0.467,0.545,0.6414,0.7897,0.8726,0.8889,0.9219,0.9129,0.9055,0.9136,0.9536
ISONE,8/24/2000,2000,8,24,237,34,WD,0.9702,0.9716,0.9728,0.9581,0.9176,0.8832,0.6761,0.5681,0.3351,0.1739,0.1106,0.0731,0.0569,0.0323,0.0135,0.0149,0.0127,0.0092,0.0228,0.0368,0.0696,0.0664,0.0802,0.1109
ISONE,8/25/2000,2000,8,25,238,34,WD,0.1005,0.071,0.1007,0.1157,0.2066,0.3266,0.4251,0.4168,0.3745,0.2781,0.2144,0.2082,0.1404,0.1096,0.0912,0.0578,0.0478,0.052,0.0664,0.0449,0.0557,0.0413,0.0343,0.0166
ISONE,8/26/2000,2000,8,26,239,34,WE,0.0053,0.0042,0.0087,0.0159,0.0176,0.0187,0.0358,0.0613,0.0809,0.0721,0.0442,0.0217,0.0185,0.0135,0.0207,0.0178,0.0319,0.0477,0.0628,0.0553,0.0491,0.0288,0.0347,0.0373
ISONE,8/27/2000,2000,8,27,240,35,WE,0.0493,0.0662,0.0798,0.0669,0.0704,0.069,0.1371,0.1702,0.2156,0.2144,0.2596,0.2577,0.3175,0.3221,0.4246,0.5025,0.6052,0.6293,0.6887,0.7569,0.7714,0.8314,0.7813,0.7161
ISONE,8/28/2000,2000,8,28,241,35,WD,0.6938,0.6254,0.5359,0.4218,0.2765,0.2132,0.1491,0.1181,0.1334,0.1501,0.1569,0.2133,0.1858,0.2417,0.2736,0.3031,0.2844,0.3535,0.3957,0.3604,0.3152,0.2605,0.1915,0.1946
ISONE,8/29/2000,2000,8,29,242,35,WD,0.2198,0.1481,0.1437,0.1743,0.1831,0.2147,0.2234,0.247,0.2799,0.3147,0.3326,0.3479,0.2943,0.3051,0.3056,0.285,0.2656,0.2549,0.2944,0.248,0.2443,0.2389,0.2418,0.1594
ISONE,8/30/2000,2000,8,30,243,35,WD,0.1132,0.1002,0.0818,0.0877,0.0676,0.0723,0.0709,0.0882,0.1047,0.1167,0.0969,0.0756,0.0599,0.0554,0.0625,0.0698,0.0815,0.0864,0.0957,0.114,0.1182,0.1292,0.1239,0.1217
ISONE,8/31/2000,2000,8,31,244,35,WD,0.113,0.1042,0.1034,0.0682,0.0561,0.0564,0.0644,0.0664,0.0708,0.0584,0.0306,0.0269,0.0309,0.037,0.0304,0.0448,0.0429,0.0559,0.0642,0.0692,0.0854,0.104,0.1225,0.1143
ISONE,9/1/2000,2000,9,1,245,35,WD,0.1617,0.1665,0.232,0.1773,0.1498,0.1634,0.1536,0.1665,0.2119,0.2035,0.1914,0.1798,0.233,0.2698,0.3057,0.3407,0.2628,0.1764,0.1129,0.0825,0.0732,0.0472,0.0257,0.0142
ISONE,9/2/2000,2000,9,2,246,35,WE,0.0106,0.0204,0.015,0.0333,0.0254,0.0314,0.0299,0.0601,0.0586,0.0274,0.0226,0.0222,0.027,0.0115,0.0099,0.0052,0.0101,0.032,0.0498,0.0461,0.0394,0.0681,0.1026,0.0936
ISONE,9/3/2000,2000,9,3,247,36,WE,0.1308,0.134,0.1061,0.0955,0.157,0.1646,0.1282,0.0835,0.0467,0.0481,0.0398,0.0369,0.0294,0.0216,0.0138,0.0162,0.0146,0.0184,0.0581,0.1874,0.2636,0.3121,0.2016,0.2046
ISONE,9/4/2000,2000,9,4,248,36,WD,0.2184,0.1987,0.1761,0.1637,0.0995,0.124,0.1888,0.1221,0.071,0.0908,0.0762,0.0502,0.0524,0.0804,0.0675,0.0909,0.1816,0.5606,0.7237,0.9087,0.9408,0.9018,0.9094,0.915
ISONE,9/5/2000,2000,9,5,249,36,WD,0.9264,0.9609,0.9491,0.9423,0.9176,0.9608,0.9693,0.9559,0.9434,0.9506,0.9422,0.9189,0.918,0.9049,0.8795,0.8189,0.8489,0.7922,0.7262,0.6756,0.5765,0.4357,0.4574,0.5017
ISONE,9/6/2000,2000,9,6,250,36,WD,0.6116,0.7335,0.8293,0.8442,0.8477,0.8583,0.8591,0.7139,0.7157,0.7739,0.7381,0.7153,0.6457,0.6723,0.6044,0.516,0.5003,0.4403,0.4644,0.3552,0.2296,0.1527,0.1235,0.1061
ISONE,9/7/2000,2000,9,7,251,36,WD,0.0916,0.0907,0.1065,0.0961,0.0937,0.0736,0.0658,0.0619,0.0362,0.0219,0.0205,0.028,0.026,0.0155,0.0145,0.0233,0.0201,0.028,0.0351,0.0615,0.087,0.1124,0.1298,0.142
ISONE,9/8/2000,2000,9,8,252,36,WD,0.1479,0.1727,0.2486,0.3095,0.312,0.342,0.335,0.2563,0.2694,0.2986,0.2812,0.3967,0.4653,0.5713,0.8104,0.8915,0.8905,0.9292,0.8639,0.8874,0.8663,0.8832,0.8014,0.8183
ISONE,9/9/2000,2000,9,9,253,36,WE,0.831,0.8967,0.8338,0.8445,0.8298,0.7348,0.6214,0.405,0.2848,0.1871,0.113,0.0726,0.0451,0.0192,0.0202,0.0341,0.0529,0.0633,0.0874,0.0529,0.0286,0.017,0.0078,0.0193
ISONE,9/10/2000,2000,9,10,254,37,WE,0.0206,0.0277,0.034,0.0455,0.0366,0.0464,0.0392,0.0493,0.053,0.0732,0.0949,0.0997,0.0824,0.0554,0.0434,0.0511,0.0489,0.0494,0.054,0.074,0.0703,0.0731,0.0638,0.0474
ISONE,9/11/2000,2000,9,11,255,37,WD,0.0528,0.0441,0.0277,0.0231,0.0164,0.0087,0.0042,0.0036,0.0039,0.0134,0.0182,0.0224,0.0231,0.0228,0.007,0.016,0.0206,0.0166,0.0176,0.0193,0.0246,0.0332,0.0367,0.0422
ISONE,9/12/2000,2000,9,12,256,37,WD,0.0469,0.0382,0.042,0.0331,0.0327,0.0342,0.0684,0.1235,0.1953,0.2404,0.3297,0.398,0.4163,0.3826,0.4581,0.5008,0.4751,0.4763,0.5058,0.554,0.7401,0.7829,0.8129,0.8462
ISONE,9/13/2000,2000,9,13,257,37,WD,0.8891,0.9498,0.9443,0.9515,0.942,0.94,0.8797,0.9464,0.8916,0.9216,0.9023,0.8155,0.7472,0.584,0.3604,0.1916,0.0948,0.1202,0.1098,0.1219,0.0995,0.1162,0.1888,0.2111
ISONE,9/14/2000,2000,9,14,258,37,WD,0.2129,0.1924,0.1626,0.1871,0.1879,0.2218,0.1781,0.1813,0.1982,0.2253,0.1466,0.0972,0.0749,0.0647,0.0646,0.0616,0.0583,0.0829,0.1037,0.1332,0.1533,0.1388,0.1536,0.1089
ISONE,9/15/2000,2000,9,15,259,37,WD,0.0996,0.2112,0.2736,0.2749,0.4886,0.6542,0.7498,0.8939,0.884,0.9024,0.9326,0.9655,0.9627,0.9666,0.9714,0.9678,0.9536,0.9159,0.9076,0.6766,0.6685,0.6637,0.7121,0.6418
ISONE,9/16/2000,2000,9,16,260,37,WE,0.6412,0.6456,0.6718,0.6622,0.636,0.5504,0.5325,0.4641,0.4624,0.4036,0.262,0.2707,0.2031,0.1914,0.1993,0.2892,0.451,0.5052,0.42,0.4186,0.6837,0.7549,0.7062,0.7834
ISONE,9/17/2000,2000,9,17,261,38,WE,0.6992,0.7002,0.6298,0.583,0.5345,0.5181,0.5167,0.4753,0.3889,0.3618,0.3579,0.5668,0.7336,0.852,0.9191,0.9648,0.9646,0.9711,0.9711,0.9665,0.9527,0.9474,0.955,0.9331
ISONE,9/18/2000,2000,9,18,262,38,WD,0.8642,0.8895,0.8821,0.8912,0.84,0.6889,0.4891,0.3711,0.2794,0.2421,0.1501,0.1166,0.1131,0.1087,0.1249,0.1668,0.2112,0.2778,0.3754,0.404,0.4073,0.3686,0.3848,0.4076
ISONE,9/19/2000,2000,9,19,263,38,WD,0.4054,0.3259,0.313,0.2361,0.1601,0.1429,0.1045,0.1328,0.1432,0.1216,0.1036,0.1475,0.2568,0.3179,0.4159,0.5355,0.5293,0.6359,0.6505,0.6118,0.718,0.7737,0.8108,0.7404
ISONE,9/20/2000,2000,9,20,264,38,WD,0.5725,0.6149,0.6707,0.54,0.4765,0.366,0.4669,0.5771,0.7988,0.8547,0.7923,0.808,0.6356,0.5896,0.5577,0.5643,0.531,0.5278,0.6026,0.5493,0.5817,0.6471,0.744,0.78
ISONE,9/21/2000,2000,9,21,265,38,WD,0.7363,0.8659,0.8708,0.8972,0.9159,0.968,0.9648,0.968,0.9647,0.9554,0.9695,0.9695,0.9635,0.9525,0.9211,0.8309,0.8091,0.8216,0.8589,0.8151,0.8307,0.7935,0.8083,0.805
ISONE,9/22/2000,2000,9,22,266,38,WD,0.8888,0.9225,0.9197,0.8753,0.7868,0.6576,0.5336,0.483,0.4375,0.3511,0.2442,0.1456,0.0763,0.0308,0.0114,0.012,0.029,0.0401,0.0473,0.0741,0.0851,0.0857,0.0941,0.1329
ISONE,9/23/2000,2000,9,23,267,38,WE,0.1507,0.1944,0.1812,0.1828,0.1409,0.0859,0.0819,0.0859,0.0804,0.0785,0.0907,0.1558,0.1885,0.2424,0.3244,0.3769,0.409,0.5026,0.5994,0.6719,0.7087,0.8105,0.8197,0.8368
ISONE,9/24/2000,2000,9,24,268,39,WE,0.8117,0.8844,0.8617,0.9308,0.9078,0.861,0.7776,0.7347,0.7201,0.8123,0.8656,0.7919,0.6725,0.6375,0.6382,0.6646,0.691,0.6471,0.67,0.4982,0.6382,0.6521,0.7527,0.7389
ISONE,9/25/2000,2000,9,25,269,39,WD,0.7259,0.6551,0.5604,0.585,0.4597,0.4701,0.2489,0.2283,0.1912,0.1377,0.1414,0.0875,0.0996,0.0847,0.1003,0.1114,0.0829,0.0637,0.1635,0.3205,0.4458,0.4918,0.5827,0.6651
ISONE,9/26/2000,2000,9,26,270,39,WD,0.7877,0.8107,0.9133,0.9396,0.9261,0.9612,0.9493,0.9646,0.9533,0.9462,0.9575,0.9684,0.9712,0.9749,0.9744,0.9747,0.9743,0.9741,0.9722,0.9673,0.9666,0.9668,0.9644,0.9472
ISONE,9/27/2000,2000,9,27,271,39,WD,0.8944,0.8627,0.858,0.7584,0.7408,0.6339,0.5794,0.5405,0.3772,0.2236,0.2155,0.1403,0.0695,0.0318,0.0332,0.0678,0.1122,0.1715,0.3098,0.3225,0.3756,0.3892,0.4731,0.4474
ISONE,9/28/2000,2000,9,28,272,39,WD,0.404,0.3799,0.4317,0.356,0.229,0.2533,0.2299,0.2919,0.5244,0.6233,0.6442,0.5864,0.666,0.6805,0.6497,0.6772,0.6628,0.6412,0.5893,0.5524,0.4902,0.4894,0.5066,0.4468
ISONE,9/29/2000,2000,9,29,273,39,WD,0.4266,0.409,0.3662,0.3534,0.3025,0.3892,0.4756,0.6097,0.626,0.6259,0.6009,0.518,0.4817,0.3986,0.4103,0.362,0.3239,0.2996,0.3192,0.2381,0.2663,0.1404,0.1024,0.0874
ISONE,9/30/2000,2000,9,30,274,39,WE,0.0686,0.0696,0.0631,0.0376,0.026,0.0279,0.0133,0.0029,0.0031,0.0059,0.0125,0.0145,0.0259,0.0183,0.0439,0.0798,0.1297,0.194,0.2118,0.2102,0.2077,0.239,0.2291,0.2353
ISONE,10/1/2000,2000,10,1,275,40,WE,0.2076,0.2187,0.1907,0.1721,0.1335,0.0989,0.0827,0.0461,0.0339,0.0452,0.0448,0.0528,0.0628,0.0784,0.0424,0.04,0.036,0.0404,0.0319,0.0277,0.0377,0.0391,0.0784,0.0984
ISONE,10/2/2000,2000,10,2,276,40,WD,0.1348,0.1638,0.1738,0.1601,0.2366,0.3181,0.4072,0.5824,0.649,0.7322,0.7651,0.7363,0.7536,0.7578,0.8107,0.792,0.7597,0.6824,0.7058,0.5222,0.4396,0.3516,0.282,0.3058
ISONE,10/3/2000,2000,10,3,277,40,WD,0.3082,0.4062,0.4197,0.3548,0.3169,0.3056,0.1914,0.139,0.2331,0.4709,0.7074,0.8043,0.6331,0.5822,0.5758,0.6185,0.565,0.6363,0.7132,0.689,0.8083,0.8579,0.8697,0.8057
ISONE,10/4/2000,2000,10,4,278,40,WD,0.695,0.5466,0.4406,0.304,0.2051,0.1191,0.0558,0.0493,0.0136,0.0041,0.0137,0.0343,0.0789,0.1707,0.2508,0.3117,0.4108,0.4475,0.4447,0.5305,0.6203,0.7657,0.827,0.8826
ISONE,10/5/2000,2000,10,5,279,40,WD,0.6634,0.6332,0.3321,0.4448,0.5935,0.6482,0.7148,0.74,0.6648,0.6038,0.5512,0.5871,0.5165,0.3513,0.3127,0.3076,0.1956,0.1502,0.1721,0.2089,0.2846,0.3125,0.4594,0.4252
ISONE,10/6/2000,2000,10,6,280,40,WD,0.4367,0.5586,0.5702,0.6244,0.67,0.619,0.5894,0.6091,0.778,0.8903,0.8983,0.8679,0.8943,0.8808,0.9333,0.8075,0.8816,0.9015,0.8967,0.8258,0.8342,0.7936,0.6942,0.613
ISONE,10/7/2000,2000,10,7,281,40,WE,0.6332,0.6548,0.6259,0.6817,0.6641,0.5321,0.4611,0.4401,0.4333,0.356,0.2764,0.268,0.1851,0.1473,0.1058,0.0614,0.0378,0.0321,0.05,0.0713,0.0836,0.13,0.1715,0.1936
ISONE,10/8/2000,2000,10,8,282,41,WE,0.1791,0.212,0.2052,0.2445,0.2116,0.2066,0.1966,0.1334,0.1473,0.1093,0.1228,0.1044,0.0844,0.1003,0.124,0.1528,0.147,0.1482,0.1507,0.0847,0.0858,0.1685,0.2975,0.5335
ISONE,10/9/2000,2000,10,9,283,41,WD,0.7393,0.7727,0.8414,0.8757,0.9112,0.9551,0.9484,0.9439,0.9255,0.9215,0.8509,0.9035,0.9067,0.8995,0.8856,0.8808,0.8878,0.9433,0.952,0.9532,0.9418,0.9373,0.9409,0.9159
ISONE,10/10/2000,2000,10,10,284,41,WD,0.8081,0.6896,0.6017,0.5473,0.5355,0.5004,0.3239,0.3947,0.4989,0.6135,0.6988,0.7413,0.77,0.7256,0.7568,0.855,0.8888,0.9288,0.942,0.9304,0.9558,0.9689,0.9727,0.9738
ISONE,10/11/2000,2000,10,11,285,41,WD,0.9708,0.9623,0.9312,0.9473,0.9642,0.9707,0.9719,0.9601,0.9377,0.9477,0.9387,0.9225,0.8266,0.8352,0.8685,0.8769,0.8495,0.7924,0.754,0.7091,0.6008,0.5202,0.5431,0.5627
ISONE,10/12/2000,2000,10,12,286,41,WD,0.4868,0.4804,0.2557,0.1474,0.0623,0.0468,0.0342,0.0284,0.0365,0.029,0.0223,0.0336,0.0618,0.107,0.1446,0.2465,0.3461,0.3975,0.4737,0.4772,0.5196,0.5175,0.4938,0.4948
ISONE,10/13/2000,2000,10,13,287,41,WD,0.5299,0.5473,0.4526,0.4198,0.3357,0.3399,0.4385,0.3138,0.1854,0.1688,0.1219,0.0903,0.0937,0.1648,0.2345,0.3618,0.4941,0.5123,0.6052,0.7387,0.6953,0.6599,0.7545,0.7326
ISONE,10/14/2000,2000,10,14,288,41,WE,0.594,0.4653,0.3672,0.3305,0.1816,0.1029,0.0787,0.0554,0.0269,0.0167,0.0402,0.092,0.1568,0.3133,0.3825,0.5462,0.6924,0.8078,0.8612,0.9088,0.9153,0.9267,0.9566,0.9464
ISONE,10/15/2000,2000,10,15,289,42,WE,0.946,0.9516,0.9419,0.8829,0.8269,0.6132,0.5381,0.4465,0.3635,0.2716,0.2142,0.2106,0.1282,0.144,0.1879,0.1955,0.2253,0.3122,0.3221,0.4844,0.5537,0.5904,0.6055,0.7062
ISONE,10/16/2000,2000,10,16,290,42,WD,0.7683,0.7602,0.7413,0.8212,0.7928,0.7657,0.7789,0.7769,0.7476,0.6092,0.6004,0.5902,0.4852,0.4825,0.4988,0.4822,0.4592,0.3955,0.4376,0.416,0.4471,0.5728,0.6078,0.555
ISONE,10/17/2000,2000,10,17,291,42,WD,0.5548,0.508,0.4489,0.3506,0.2703,0.2367,0.3007,0.2968,0.3462,0.2842,0.2216,0.141,0.1481,0.2419,0.3541,0.3999,0.4603,0.463,0.4942,0.4044,0.4309,0.4856,0.5266,0.5905
ISONE,10/18/2000,2000,10,18,292,42,WD,0.586,0.6977,0.7138,0.7464,0.7026,0.7423,0.7439,0.6427,0.6043,0.5525,0.4352,0.3127,0.1832,0.1212,0.1005,0.089,0.0728,0.0697,0.0919,0.0487,0.0381,0.0486,0.0561,0.0917
ISONE,10/19/2000,2000,10,19,293,42,WD,0.2668,0.711,0.8272,0.935,0.9537,0.9202,0.9237,0.8936,0.904,0.8745,0.815,0.7063,0.6709,0.6384,0.7379,0.7675,0.7814,0.7345,0.8066,0.8337,0.8967,0.9352,0.9326,0.9282
ISONE,10/20/2000,2000,10,20,294,42,WD,0.9518,0.9374,0.937,0.9144,0.8472,0.6933,0.5805,0.4673,0.3683,0.2874,0.2326,0.1714,0.0727,0.0185,0.0179,0.0354,0.1063,0.1467,0.222,0.2676,0.3667,0.4518,0.4691,0.4587
ISONE,10/21/2000,2000,10,21,295,42,WE,0.4177,0.4691,0.5189,0.5003,0.4024,0.4081,0.4045,0.4052,0.3937,0.4092,0.4942,0.4862,0.6213,0.6962,0.7883,0.799,0.8419,0.8539,0.8759,0.8474,0.7813,0.794,0.738,0.6936
ISONE,10/22/2000,2000,10,22,296,43,WE,0.6445,0.8996,0.9283,0.9388,0.9271,0.9305,0.9103,0.8772,0.8608,0.9058,0.827,0.7566,0.6823,0.6396,0.5972,0.5293,0.6396,0.6618,0.6876,0.6099,0.6353,0.5682,0.5789,0.5904
ISONE,10/23/2000,2000,10,23,297,43,WD,0.6034,0.6077,0.6493,0.4546,0.384,0.3621,0.3604,0.3755,0.3079,0.242,0.176,0.1631,0.1442,0.1179,0.0705,0.0378,0.0266,0.0161,0.0126,0.0178,0.0201,0.0402,0.0698,0.1171
ISONE,10/24/2000,2000,10,24,298,43,WD,0.1046,0.0816,0.0746,0.0645,0.0685,0.0689,0.0638,0.0697,0.0827,0.0717,0.0631,0.0877,0.125,0.2073,0.2823,0.3567,0.3494,0.4241,0.5073,0.4368,0.4554,0.5001,0.4757,0.4223
ISONE,10/25/2000,2000,10,25,299,43,WD,0.373,0.3806,0.3691,0.3403,0.2257,0.1258,0.1433,0.1551,0.2103,0.2004,0.1786,0.135,0.1162,0.0972,0.1134,0.084,0.0694,0.0466,0.0281,0.0372,0.0322,0.0264,0.0186,0.0147
ISONE,10/26/2000,2000,10,26,300,43,WD,0.0109,0.0113,0.0092,0.0145,0.019,0.0126,0.0032,0.0027,0.0031,0.0009,0.0034,0.0031,0.0044,0.0071,0.0073,0.0122,0.0137,0.0154,0.022,0.0287,0.0363,0.0543,0.0633,0.0764
ISONE,10/27/2000,2000,10,27,301,43,WD,0.0802,0.0652,0.0664,0.084,0.0783,0.0634,0.0852,0.1034,0.1356,0.1266,0.0932,0.1412,0.2191,0.302,0.3187,0.3912,0.2948,0.2617,0.2017,0.3264,0.3871,0.3446,0.3549,0.2343
ISONE,10/28/2000,2000,10,28,302,43,WE,0.179,0.1875,0.1725,0.2805,0.3086,0.3666,0.3639,0.539,0.8425,0.966,0.9738,0.9747,0.9746,0.9744,0.9739,0.9734,0.972,0.9737,0.9738,0.9743,0.9745,0.9743,0.9743,0.9739
ISONE,10/29/2000,2000,10,29,303,44,WE,0.9741,0.9743,0.9729,0.973,0.9733,0.9725,0.9557,0.9593,0.9512,0.9291,0.8956,0.8296,0.7903,0.8147,0.8546,0.8496,0.8309,0.8328,0.8258,0.832,0.8053,0.8633,0.8963,0.9046
ISONE,10/30/2000,2000,10,30,304,44,WD,0.8766,0.8535,0.8188,0.8304,0.7519,0.7473,0.7525,0.7547,0.6943,0.6533,0.6043,0.4469,0.4346,0.3822,0.3535,0.3152,0.4062,0.5993,0.7603,0.8288,0.8663,0.8499,0.7576,0.8123
ISONE,10/31/2000,2000,10,31,305,44,WD,0.7918,0.8309,0.8409,0.8287,0.6629,0.6197,0.6536,0.5455,0.5723,0.5895,0.6691,0.6166,0.8626,0.9616,0.9745,0.9742,0.9746,0.9727,0.9684,0.9651,0.9645,0.9661,0.9682,0.9646
ISONE,11/1/2000,2000,11,1,306,44,WD,0.9709,0.9705,0.9724,0.97,0.971,0.9693,0.9661,0.9662,0.9513,0.9558,0.9585,0.9647,0.9587,0.9687,0.9713,0.9691,0.9696,0.9648,0.9622,0.9514,0.9657,0.971,0.9678,0.9662
ISONE,11/2/2000,2000,11,2,307,44,WD,0.9656,0.9667,0.9692,0.9656,0.9654,0.9549,0.9333,0.8771,0.8714,0.7097,0.8995,0.917,0.9346,0.9408,0.9226,0.8535,0.9476,0.9429,0.947,0.9011,0.8877,0.8716,0.8771,0.8463
ISONE,11/3/2000,2000,11,3,308,44,WD,0.755,0.7758,0.8026,0.7764,0.674,0.6918,0.641,0.6985,0.6874,0.6152,0.511,0.4929,0.5676,0.6521,0.685,0.6692,0.6111,0.533,0.4743,0.4474,0.4289,0.3564,0.2182,0.1393
ISONE,11/4/2000,2000,11,4,309,44,WE,0.1042,0.0793,0.0604,0.0397,0.0708,0.0186,0.0094,0.0064,0.0041,0.005,0.0097,0.0193,0.0072,0.014,0.0311,0.0367,0.0558,0.058,0.05,0.0651,0.0848,0.0876,0.1175,0.1409
ISONE,11/5/2000,2000,11,5,310,45,WE,0.1493,0.1003,0.0688,0.0651,0.0535,0.0684,0.1333,0.1534,0.1505,0.2132,0.3171,0.5213,0.6539,0.814,0.8861,0.9297,0.9599,0.959,0.9409,0.9454,0.9346,0.9274,0.9585,0.9627
ISONE,11/6/2000,2000,11,6,311,45,WD,0.9643,0.9563,0.9429,0.9504,0.9571,0.9465,0.9159,0.9043,0.8629,0.8273,0.8528,0.8681,0.7987,0.7581,0.8077,0.795,0.8407,0.8318,0.8112,0.7671,0.7947,0.8378,0.8786,0.8735
ISONE,11/7/2000,2000,11,7,312,45,WD,0.8361,0.8267,0.8911,0.8412,0.8226,0.7966,0.7656,0.8169,0.7791,0.7149,0.6128,0.5057,0.5694,0.5576,0.5528,0.5665,0.5948,0.5562,0.5424,0.5302,0.5949,0.6854,0.6647,0.5089
ISONE,11/8/2000,2000,11,8,313,45,WD,0.2886,0.4077,0.3636,0.3451,0.2987,0.324,0.3378,0.3418,0.3347,0.3746,0.3377,0.2698,0.2312,0.2317,0.1449,0.0985,0.0709,0.0596,0.0788,0.1291,0.0776,0.107,0.1169,0.0783
ISONE,11/9/2000,2000,11,9,314,45,WD,0.0923,0.1141,0.139,0.1446,0.1501,0.1034,0.0793,0.059,0.0625,0.1112,0.0906,0.0984,0.072,0.1144,0.1676,0.1208,0.1031,0.0662,0.0494,0.058,0.0715,0.0764,0.1081,0.1186
ISONE,11/10/2000,2000,11,10,315,45,WD,0.1029,0.1026,0.1215,0.2035,0.2609,0.4161,0.6284,0.7662,0.9316,0.9384,0.9539,0.9742,0.9729,0.9739,0.9733,0.9694,0.9663,0.9613,0.7743,0.6762,0.6678,0.6974,0.5057,0.437
ISONE,11/11/2000,2000,11,11,316,45,WE,0.2841,0.269,0.2009,0.1388,0.0271,0.0422,0.1469,0.2978,0.6916,0.9222,0.9604,0.9504,0.9378,0.8919,0.9042,0.8581,0.8358,0.8558,0.8018,0.8409,0.8632,0.9138,0.9107,0.8952
ISONE,11/12/2000,2000,11,12,317,46,WE,0.9465,0.9313,0.9509,0.9466,0.9373,0.8593,0.9199,0.874,0.8222,0.8279,0.8144,0.9044,0.8854,0.8664,0.831,0.8393,0.8054,0.737,0.5803,0.371,0.3433,0.3999,0.2494,0.2422
ISONE,11/13/2000,2000,11,13,318,46,WD,0.2846,0.2808,0.2337,0.2056,0.1623,0.0947,0.0676,0.0367,0.026,0.0419,0.0921,0.0992,0.098,0.0765,0.0772,0.0661,0.0443,0.0515,0.0324,0.0368,0.0513,0.0793,0.1154,0.1126
ISONE,11/14/2000,2000,11,14,319,46,WD,0.0985,0.0622,0.0515,0.0555,0.0823,0.1582,0.278,0.4332,0.5231,0.5632,0.5544,0.5501,0.6933,0.6864,0.7131,0.6929,0.7755,0.8541,0.6799,0.7302,0.7448,0.7695,0.6481,0.7101
ISONE,11/15/2000,2000,11,15,320,46,WD,0.8117,0.9446,0.9718,0.9722,0.9711,0.9693,0.9607,0.9608,0.9429,0.9112,0.8788,0.8347,0.7879,0.752,0.8001,0.847,0.8754,0.9325,0.9431,0.9429,0.9582,0.9659,0.9662,0.9576
ISONE,11/16/2000,2000,11,16,321,46,WD,0.9513,0.9398,0.9205,0.8882,0.8471,0.781,0.6318,0.5498,0.4551,0.4264,0.5017,0.4649,0.6729,0.7984,0.8401,0.8789,0.8938,0.9321,0.9649,0.9699,0.9679,0.9694,0.9748,0.9743
ISONE,11/17/2000,2000,11,17,322,46,WD,0.9734,0.9696,0.9577,0.9436,0.866,0.8493,0.856,0.8665,0.8639,0.9165,0.9029,0.9029,0.9162,0.8789,0.9134,0.9078,0.8764,0.906,0.863,0.973,0.9743,0.9737,0.973,0.9743
ISONE,11/18/2000,2000,11,18,323,46,WE,0.9729,0.9714,0.9703,0.9617,0.9615,0.9475,0.9154,0.8954,0.861,0.8183,0.7701,0.6394,0.5649,0.3904,0.3859,0.315,0.282,0.3147,0.3123,0.2794,0.2418,0.2166,0.2195,0.2388
ISONE,11/19/2000,2000,11,19,324,47,WE,0.2194,0.143,0.144,0.089,0.0885,0.083,0.1056,0.148,0.2181,0.2821,0.259,0.2313,0.119,0.0577,0.0208,0.0217,0.0311,0.0499,0.0408,0.031,0.0328,0.0451,0.073,0.0755
ISONE,11/20/2000,2000,11,20,325,47,WD,0.0372,0.0244,0.0232,0.0152,0.0121,0.0103,0.0141,0.0405,0.0481,0.093,0.1329,0.1674,0.2325,0.31,0.408,0.448,0.5516,0.6806,0.7377,0.698,0.7484,0.7623,0.7348,0.8454
ISONE,11/21/2000,2000,11,21,326,47,WD,0.8483,0.8463,0.8603,0.8382,0.8045,0.7951,0.7774,0.6899,0.6372,0.5467,0.5666,0.4822,0.4302,0.4006,0.5314,0.6081,0.6544,0.6661,0.7072,0.8309,0.9061,0.9659,0.9582,0.9607
ISONE,11/22/2000,2000,11,22,327,47,WD,0.9489,0.9512,0.9574,0.9477,0.9587,0.9609,0.9614,0.9495,0.9595,0.9598,0.9325,0.9346,0.8918,0.9073,0.9027,0.9119,0.9054,0.9259,0.9457,0.9568,0.9646,0.9643,0.9475,0.905
ISONE,11/23/2000,2000,11,23,328,47,WD,0.8505,0.9148,0.8836,0.8894,0.8644,0.7805,0.8646,0.8771,0.8186,0.7271,0.5964,0.5153,0.3839,0.3511,0.2671,0.237,0.1926,0.1904,0.1748,0.1758,0.1733,0.2438,0.2211,0.224
ISONE,11/24/2000,2000,11,24,329,47,WD,0.2209,0.2278,0.2531,0.2914,0.2829,0.2984,0.3562,0.4423,0.3919,0.3892,0.3569,0.3497,0.3889,0.3307,0.3064,0.2597,0.2315,0.2011,0.1631,0.1151,0.1333,0.1286,0.1445,0.0957
ISONE,11/25/2000,2000,11,25,330,47,WE,0.0694,0.0693,0.0504,0.0292,0.0179,0.0196,0.0188,0.0142,0.0101,0.0051,0.0052,0.0035,0.0036,0.0061,0.0126,0.021,0.0346,0.0529,0.0708,0.108,0.1758,0.2564,0.3235,0.449
ISONE,11/26/2000,2000,11,26,331,48,WE,0.4046,0.4456,0.532,0.6422,0.7863,0.8933,0.9581,0.9607,0.9702,0.9728,0.9733,0.9749,0.975,0.9742,0.9733,0.9365,0.9728,0.9743,0.9743,0.9724,0.9705,0.9592,0.9707,0.9675
ISONE,11/27/2000,2000,11,27,332,48,WD,0.9518,0.9345,0.9578,0.9589,0.9627,0.9434,0.9435,0.9535,0.9373,0.9385,0.9477,0.9639,0.9581,0.9347,0.9549,0.9573,0.9571,0.9542,0.9034,0.9057,0.9019,0.8377,0.7902,0.7866
ISONE,11/28/2000,2000,11,28,333,48,WD,0.7488,0.7146,0.7654,0.7301,0.5979,0.5334,0.4967,0.5251,0.5821,0.5537,0.4939,0.3591,0.2989,0.2662,0.2647,0.2974,0.2483,0.2988,0.2705,0.2587,0.2688,0.1956,0.1182,0.0929
ISONE,11/29/2000,2000,11,29,334,48,WD,0.1115,0.2008,0.2896,0.3496,0.5117,0.6961,0.5562,0.5156,0.4241,0.3084,0.1966,0.1393,0.1278,0.1365,0.1572,0.209,0.2562,0.2601,0.2327,0.1014,0.0775,0.0686,0.0378,0.0164
ISONE,11/30/2000,2000,11,30,335,48,WD,0.0132,0.0271,0.0283,0.0115,0.0282,0.0866,0.1645,0.2073,0.3529,0.553,0.6897,0.7029,0.7984,0.9189,0.9293,0.9691,0.9719,0.9706,0.9693,0.9571,0.9563,0.9575,0.9524,0.9469
ISONE,12/1/2000,2000,12,1,336,48,WD,0.9453,0.9425,0.9348,0.9343,0.8849,0.8423,0.8376,0.74,0.6613,0.5496,0.4334,0.336,0.2149,0.1808,0.1613,0.1697,0.2019,0.2118,0.2565,0.3813,0.4597,0.4151,0.3584,0.3955
ISONE,12/2/2000,2000,12,2,337,48,WE,0.4218,0.487,0.5103,0.5673,0.5824,0.6102,0.5774,0.6091,0.5879,0.5362,0.6196,0.7125,0.642,0.6303,0.6897,0.6948,0.724,0.7936,0.8341,0.8585,0.8461,0.8262,0.765,0.6675
ISONE,12/3/2000,2000,12,3,338,49,WE,0.5778,0.5798,0.6181,0.5609,0.5166,0.4827,0.4376,0.3921,0.3506,0.2895,0.2006,0.1049,0.0783,0.0619,0.0792,0.0822,0.0804,0.0946,0.1091,0.1179,0.1208,0.1695,0.188,0.2001
ISONE,12/4/2000,2000,12,4,339,49,WD,0.1626,0.1708,0.1792,0.1562,0.1758,0.1576,0.2028,0.1591,0.1694,0.1565,0.2288,0.2184,0.1686,0.1004,0.0576,0.0165,0.0113,0.0185,0.0383,0.0862,0.1709,0.2477,0.22,0.2116
ISONE,12/5/2000,2000,12,5,340,49,WD,0.3024,0.2596,0.1894,0.1842,0.214,0.2688,0.2742,0.3145,0.3517,0.4713,0.7586,0.7917,0.8536,0.9257,0.9218,0.9127,0.9444,0.9723,0.9744,0.9745,0.9748,0.9746,0.9745,0.9743
ISONE,12/6/2000,2000,12,6,341,49,WD,0.9739,0.9745,0.9736,0.9715,0.9704,0.9692,0.9486,0.9145,0.8938,0.8641,0.7635,0.6159,0.507,0.3243,0.1923,0.196,0.1527,0.204,0.27,0.3344,0.4393,0.52,0.6324,0.6054
ISONE,12/7/2000,2000,12,7,342,49,WD,0.6302,0.7542,0.7742,0.7562,0.7952,0.8038,0.7947,0.7617,0.8504,0.8528,0.9144,0.9644,0.9667,0.9594,0.9475,0.9449,0.9373,0.9398,0.9529,0.9376,0.9601,0.9588,0.9602,0.9061
ISONE,12/8/2000,2000,12,8,343,49,WD,0.9263,0.8885,0.8045,0.6205,0.4405,0.233,0.1126,0.0606,0.0553,0.0862,0.1221,0.2471,0.3112,0.3427,0.5326,0.582,0.6998,0.7606,0.7151,0.6187,0.5603,0.486,0.4788,0.4435
ISONE,12/9/2000,2000,12,9,344,49,WE,0.3669,0.3523,0.3552,0.459,0.5091,0.32,0.2698,0.2236,0.2165,0.2861,0.2967,0.2843,0.3375,0.3144,0.3904,0.3644,0.3093,0.3053,0.3623,0.3905,0.3356,0.3032,0.2891,0.2085
ISONE,12/10/2000,2000,12,10,345,50,WE,0.2278,0.2117,0.209,0.2232,0.1755,0.1294,0.1039,0.0769,0.0536,0.0765,0.0952,0.091,0.0558,0.0752,0.0861,0.1313,0.1903,0.2511,0.3378,0.3306,0.4424,0.4696,0.5281,0.4627
ISONE,12/11/2000,2000,12,11,346,50,WD,0.407,0.424,0.4163,0.3885,0.4281,0.5767,0.6523,0.71,0.7535,0.7728,0.6095,0.4251,0.3371,0.2232,0.1013,0.048,0.0155,0.0151,0.0124,0.015,0.0232,0.0772,0.1484,0.2617
ISONE,12/12/2000,2000,12,12,347,50,WD,0.2892,0.6981,0.9234,0.968,0.9748,0.975,0.9728,0.9683,0.9654,0.9661,0.9708,0.9741,0.975,0.975,0.9746,0.975,0.975,0.975,0.975,0.975,0.975,0.9745,0.9732,0.9661
ISONE,12/13/2000,2000,12,13,348,50,WD,0.9432,0.9309,0.9291,0.8756,0.8511,0.782,0.6823,0.4717,0.3213,0.2379,0.1781,0.1513,0.0988,0.0572,0.0335,0.0287,0.021,0.0155,0.0119,0.0146,0.0325,0.0532,0.083,0.1163
ISONE,12/14/2000,2000,12,14,349,50,WD,0.1841,0.2809,0.3438,0.4498,0.5454,0.6793,0.8114,0.9242,0.9552,0.9739,0.9704,0.9719,0.9707,0.9721,0.9735,0.9747,0.975,0.975,0.975,0.9748,0.9719,0.9688,0.9594,0.9668
ISONE,12/15/2000,2000,12,15,350,50,WD,0.9644,0.9638,0.9611,0.9614,0.9577,0.9303,0.8838,0.8168,0.7642,0.6335,0.532,0.4257,0.3683,0.2439,0.1487,0.0948,0.087,0.0879,0.0728,0.0513,0.0658,0.0687,0.1005,0.1177
ISONE,12/16/2000,2000,12,16,351,50,WE,0.1168,0.115,0.116,0.1128,0.1572,0.2164,0.2581,0.2646,0.2367,0.3,0.3068,0.4075,0.4548,0.4841,0.6504,0.7606,0.8307,0.8491,0.9288,0.9688,0.9744,0.975,0.975,0.975
ISONE,12/17/2000,2000,12,17,352,51,WE,0.975,0.9749,0.9749,0.975,0.975,0.975,0.975,0.9276,0.8397,0.8642,0.9353,0.9098,0.9391,0.8375,0.8326,0.8539,0.7009,0.9733,0.975,0.975,0.975,0.975,0.975,0.975
ISONE,12/18/2000,2000,12,18,353,51,WD,0.9748,0.9746,0.9749,0.975,0.975,0.975,0.975,0.975,0.975,0.9746,0.974,0.9736,0.9641,0.9516,0.9466,0.922,0.8679,0.8212,0.6917,0.5137,0.448,0.3126,0.3592,0.2543
ISONE,12/19/2000,2000,12,19,354,51,WD,0.2017,0.1807,0.1326,0.168,0.1729,0.1677,0.1607,0.1864,0.2054,0.1306,0.098,0.0768,0.0684,0.0283,0.0192,0.0595,0.2463,0.4942,0.7588,0.8176,0.9111,0.9234,0.8935,0.837
ISONE,12/20/2000,2000,12,20,355,51,WD,0.9525,0.8587,0.956,0.972,0.9744,0.9706,0.965,0.9512,0.8791,0.8962,0.9127,0.9713,0.9731,0.9719,0.9731,0.9726,0.9733,0.9735,0.9725,0.9701,0.9645,0.9582,0.9358,0.8269
ISONE,12/21/2000,2000,12,21,356,51,WD,0.7243,0.6305,0.4448,0.3481,0.2365,0.2114,0.1333,0.0679,0.0395,0.0485,0.062,0.1389,0.143,0.1498,0.174,0.2016,0.2065,0.1794,0.2282,0.2769,0.3478,0.4087,0.4292,0.3893
ISONE,12/22/2000,2000,12,22,357,51,WD,0.2449,0.1205,0.0966,0.1264,0.1415,0.1859,0.2142,0.2572,0.2916,0.3044,0.2558,0.2141,0.2089,0.1794,0.2828,0.3344,0.348,0.4609,0.6117,0.8165,0.9626,0.9672,0.9724,0.9725
ISONE,12/23/2000,2000,12,23,358,51,WE,0.9742,0.9745,0.9746,0.9731,0.9711,0.9696,0.9703,0.9709,0.9664,0.9661,0.9607,0.9471,0.9435,0.8968,0.76,0.7514,0.7219,0.7367,0.7556,0.8285,0.8215,0.7551,0.8048,0.7904
ISONE,12/24/2000,2000,12,24,359,52,WE,0.707,0.6319,0.5819,0.4256,0.3037,0.2249,0.1923,0.1105,0.0646,0.0305,0.03,0.0552,0.069,0.1508,0.2154,0.4309,0.5778,0.6458,0.788,0.7841,0.8771,0.9582,0.966,0.9554
ISONE,12/25/2000,2000,12,25,360,52,WD,0.9505,0.9596,0.9677,0.9716,0.9704,0.9679,0.9698,0.9653,0.9663,0.9708,0.9681,0.9728,0.9734,0.9731,0.9732,0.9741,0.9737,0.9737,0.9737,0.9733,0.9704,0.97,0.9724,0.9733
ISONE,12/26/2000,2000,12,26,361,52,WD,0.9738,0.974,0.9744,0.9739,0.974,0.9735,0.9734,0.9735,0.9707,0.97,0.9696,0.9732,0.9733,0.9732,0.9737,0.9741,0.9745,0.9748,0.975,0.975,0.9749,0.9746,0.9743,0.9738
ISONE,12/27/2000,2000,12,27,362,52,WD,0.9739,0.9736,0.9734,0.9735,0.9709,0.9671,0.9681,0.9361,0.9448,0.9566,0.9486,0.9485,0.9112,0.8899,0.8954,0.8912,0.9035,0.9447,0.9632,0.9598,0.9696,0.9727,0.972,0.9703
ISONE,12/28/2000,2000,12,28,363,52,WD,0.9713,0.9713,0.9724,0.9731,0.9682,0.9575,0.9187,0.9408,0.9284,0.9027,0.8916,0.827,0.9179,0.9074,0.9092,0.9366,0.8752,0.9161,0.9363,0.9289,0.965,0.9702,0.9676,0.9258
ISONE,12/29/2000,2000,12,29,364,52,WD,0.9096,0.8941,0.8857,0.795,0.7819,0.6588,0.6375,0.5609,0.4496,0.3367,0.2491,0.1689,0.1158,0.0846,0.0838,0.1007,0.0825,0.096,0.0754,0.0794,0.1131,0.0932,0.0932,0.0939
ISONE,12/30/2000,2000,12,30,365,52,WE,0.0789,0.0545,0.0976,0.1567,0.1941,0.2479,0.3691,0.519,0.658,0.8107,0.8803,0.9541,0.975,0.975,0.975,0.9741,0.975,0.9746,0.9721,0.9109,0.9434,0.9749,0.975,0.975
ISONE,12/31/2000,2000,12,31,366,53,WE,0.9748,0.9743,0.9749,0.975,0.975,0.9747,0.9745,0.9747,0.975,0.9749,0.9745,0.9743,0.9748,0.975,0.975,0.975,0.975,0.9743,0.9741,0.9738,0.9747,0.9745,0.9736,0.9742
ISONE,1/1/2001,2001,1,1,1,0,WD,0.9741,0.9744,0.9738,0.9708,0.9698,0.9616,0.9603,0.922,0.8748,0.8793,0.8085,0.6938,0.6184,0.4671,0.4522,0.3948,0.3614,0.3509,0.4186,0.3968,0.5052,0.4483,0.3664,0.3176
ISONE,1/2/2001,2001,1,2,2,0,WD,0.2913,0.2621,0.2547,0.3137,0.3468,0.2918,0.3025,0.3323,0.3696,0.342,0.3438,0.2973,0.3225,0.3691,0.305,0.2713,0.281,0.331,0.5113,0.5672,0.6239,0.5508,0.6455,0.7214
ISONE,1/3/2001,2001,1,3,3,0,WD,0.7727,0.7958,0.7538,0.7233,0.6959,0.668,0.6106,0.5751,0.5389,0.3996,0.2737,0.2014,0.1495,0.101,0.0983,0.1124,0.1384,0.1296,0.1488,0.1369,0.1663,0.1662,0.2037,0.2844
ISONE,1/4/2001,2001,1,4,4,0,WD,0.3309,0.3364,0.3402,0.4354,0.423,0.4144,0.4692,0.5127,0.5146,0.6367,0.7402,0.7656,0.6275,0.5629,0.6791,0.6572,0.6587,0.6723,0.6805,0.7046,0.7423,0.6838,0.6458,0.662
ISONE,1/5/2001,2001,1,5,5,0,WD,0.817,0.7588,0.6428,0.5622,0.4407,0.2855,0.1416,0.1009,0.0939,0.136,0.1149,0.1953,0.2384,0.32,0.3043,0.3616,0.3926,0.4409,0.4468,0.43,0.4354,0.2724,0.2043,0.2106
ISONE,1/6/2001,2001,1,6,6,0,WE,0.2141,0.2219,0.2865,0.2759,0.1798,0.1611,0.1741,0.2299,0.4353,0.7293,0.8098,0.8525,0.9155,0.9344,0.9411,0.9521,0.9452,0.9514,0.946,0.9504,0.9509,0.9416,0.9396,0.9315
ISONE,1/7/2001,2001,1,7,7,1,WE,0.9268,0.922,0.9376,0.8982,0.8533,0.783,0.7388,0.6825,0.6128,0.5413,0.4747,0.4114,0.3933,0.3313,0.2672,0.2209,0.1661,0.1138,0.0618,0.0931,0.0439,0.0527,0.0755,0.1445
ISONE,1/8/2001,2001,1,8,8,1,WD,0.1574,0.156,0.143,0.1433,0.1257,0.157,0.2111,0.2647,0.2219,0.1748,0.1661,0.1774,0.2173,0.2114,0.2545,0.3183,0.3521,0.5651,0.6596,0.7608,0.8967,0.8358,0.8645,0.8945
ISONE,1/9/2001,2001,1,9,9,1,WD,0.7731,0.8243,0.856,0.868,0.8139,0.8288,0.7481,0.5819,0.6138,0.4457,0.4422,0.4144,0.3655,0.3522,0.466,0.6076,0.734,0.8343,0.8787,0.8992,0.9571,0.9621,0.959,0.9598
ISONE,1/10/2001,2001,1,10,10,1,WD,0.9362,0.9699,0.9744,0.975,0.9748,0.9746,0.9746,0.9743,0.9744,0.9706,0.9522,0.8064,0.7318,0.6206,0.6261,0.6298,0.5437,0.5435,0.597,0.5256,0.4508,0.5053,0.4777,0.4941
ISONE,1/11/2001,2001,1,11,11,1,WD,0.4283,0.3645,0.3103,0.3659,0.5306,0.7436,0.855,0.8592,0.9404,0.9377,0.9313,0.929,0.9347,0.9199,0.9154,0.8935,0.8793,0.9271,0.9596,0.9661,0.9694,0.9714,0.9702,0.9678
ISONE,1/12/2001,2001,1,12,12,1,WD,0.9446,0.9343,0.8881,0.8491,0.8278,0.8317,0.7847,0.7982,0.7011,0.6663,0.5219,0.4656,0.3302,0.2726,0.2024,0.1292,0.1245,0.1534,0.156,0.171,0.2021,0.2059,0.1493,0.1451
ISONE,1/13/2001,2001,1,13,13,1,WE,0.101,0.0732,0.0436,0.0456,0.0444,0.0417,0.0383,0.0234,0.0183,0.0127,0.0123,0.0125,0.0126,0.0211,0.0207,0.024,0.0307,0.0603,0.1053,0.159,0.1971,0.1871,0.2752,0.3293
ISONE,1/14/2001,2001,1,14,14,2,WE,0.3984,0.3919,0.4099,0.3619,0.435,0.3569,0.3878,0.2818,0.2931,0.3419,0.4238,0.4554,0.5047,0.5367,0.4831,0.3907,0.2962,0.2818,0.2418,0.1224,0.0824,0.0643,0.0481,0.0473
ISONE,1/15/2001,2001,1,15,15,2,WD,0.0691,0.1742,0.2496,0.3794,0.3588,0.4183,0.4485,0.5757,0.5151,0.462,0.4794,0.6316,0.7077,0.8549,0.9028,0.921,0.915,0.8337,0.7271,0.5586,0.3526,0.274,0.292,0.2666
ISONE,1/16/2001,2001,1,16,16,2,WD,0.1341,0.0934,0.1277,0.1273,0.1168,0.1255,0.1856,0.2569,0.2961,0.2976,0.2906,0.3127,0.3375,0.4096,0.4813,0.5055,0.5076,0.5315,0.4891,0.5684,0.5976,0.6106,0.6407,0.8014
ISONE,1/17/2001,2001,1,17,17,2,WD,0.8565,0.8066,0.806,0.7798,0.7403,0.7403,0.5787,0.5633,0.5879,0.5883,0.548,0.4002,0.3074,0.2342,0.2153,0.2106,0.2403,0.2467,0.2516,0.2554,0.306,0.4144,0.4584,0.4758
ISONE,1/18/2001,2001,1,18,18,2,WD,0.5531,0.5474,0.5062,0.4205,0.2779,0.1363,0.1033,0.0549,0.0266,0.0078,0.0041,0.0044,0.0036,0.0043,0.0044,0.0111,0.024,0.0291,0.0829,0.1054,0.1246,0.1293,0.1057,0.1021
ISONE,1/19/2001,2001,1,19,19,2,WD,0.0397,0.0197,0.0174,0.0367,0.0467,0.067,0.1186,0.194,0.2231,0.3148,0.299,0.2865,0.2763,0.3085,0.403,0.4001,0.3363,0.4429,0.5521,0.6531,0.6627,0.6024,0.619,0.6895
ISONE,1/20/2001,2001,1,20,20,2,WE,0.686,0.6662,0.7397,0.7982,0.8162,0.8295,0.9037,0.9291,0.9616,0.9593,0.9575,0.9671,0.9725,0.9744,0.9714,0.9743,0.9729,0.9739,0.9745,0.9745,0.975,0.975,0.975,0.9749
ISONE,1/21/2001,2001,1,21,21,3,WE,0.9744,0.9742,0.9742,0.9733,0.9732,0.973,0.9745,0.9743,0.9743,0.9749,0.9745,0.9742,0.974,0.9733,0.9716,0.9693,0.9592,0.9561,0.9594,0.9262,0.8647,0.8461,0.8544,0.867
ISONE,1/22/2001,2001,1,22,22,3,WD,0.8299,0.767,0.6724,0.5669,0.4374,0.3756,0.2278,0.1606,0.1189,0.1093,0.1248,0.1331,0.131,0.1138,0.0801,0.0785,0.0568,0.0405,0.0326,0.0488,0.0576,0.0514,0.0564,0.0619
ISONE,1/23/2001,2001,1,23,23,3,WD,0.0535,0.0434,0.0443,0.0521,0.0511,0.051,0.0497,0.0669,0.0634,0.069,0.0578,0.0537,0.0318,0.0277,0.024,0.0417,0.036,0.0123,0.0167,0.0226,0.0267,0.0328,0.0519,0.0867
ISONE,1/24/2001,2001,1,24,24,3,WD,0.1435,0.2595,0.2873,0.2873,0.2446,0.1744,0.1542,0.1613,0.1089,0.1092,0.1109,0.072,0.0527,0.0466,0.0444,0.0588,0.0432,0.0612,0.0728,0.0896,0.0995,0.1381,0.1224,0.1346
ISONE,1/25/2001,2001,1,25,25,3,WD,0.1565,0.1809,0.2035,0.2269,0.227,0.2301,0.2507,0.2034,0.2097,0.2364,0.2433,0.2483,0.3194,0.4204,0.4697,0.5287,0.6777,0.6693,0.6957,0.7832,0.884,0.9087,0.894,0.902
ISONE,1/26/2001,2001,1,26,26,3,WD,0.907,0.8823,0.8224,0.7718,0.6156,0.4307,0.4601,0.4163,0.3521,0.3139,0.2468,0.1268,0.0674,0.0192,0.0289,0.0544,0.0904,0.0986,0.1104,0.1388,0.1733,0.1927,0.2102,0.2243
ISONE,1/27/2001,2001,1,27,27,3,WE,0.1883,0.225,0.1641,0.1923,0.1474,0.2036,0.2258,0.3075,0.3628,0.4713,0.5311,0.2921,0.3475,0.4027,0.4507,0.506,0.7,0.7878,0.8578,0.8525,0.9315,0.9647,0.9701,0.9723
ISONE,1/28/2001,2001,1,28,28,4,WE,0.9731,0.974,0.9701,0.9647,0.9703,0.9703,0.9629,0.9555,0.9504,0.922,0.8889,0.7728,0.743,0.6852,0.6736,0.634,0.6212,0.6841,0.6483,0.734,0.7809,0.7518,0.7373,0.6938
ISONE,1/29/2001,2001,1,29,29,4,WD,0.64,0.5966,0.5828,0.5143,0.4038,0.3684,0.3134,0.2804,0.2241,0.2056,0.1407,0.0954,0.084,0.0754,0.1096,0.1596,0.2176,0.3066,0.3942,0.4079,0.3957,0.4434,0.5104,0.5393
ISONE,1/30/2001,2001,1,30,30,4,WD,0.4375,0.3483,0.2627,0.2727,0.2401,0.2212,0.2511,0.2788,0.3472,0.4795,0.8256,0.9333,0.975,0.975,0.9741,0.97,0.9709,0.975,0.9748,0.9748,0.9748,0.9748,0.9749,0.9749
ISONE,1/31/2001,2001,1,31,31,4,WD,0.9688,0.9288,0.9611,0.9476,0.9347,0.9019,0.7938,0.6958,0.5828,0.3669,0.3821,0.3027,0.3338,0.4736,0.6929,0.728,0.795,0.8768,0.9425,0.9251,0.9599,0.973,0.9728,0.9667
ISONE,2/1/2001,2001,2,1,32,4,WD,0.9098,0.8738,0.802,0.7072,0.6999,0.6529,0.4942,0.4754,0.4302,0.3761,0.3112,0.3029,0.2584,0.2406,0.2491,0.2868,0.2411,0.3132,0.2926,0.262,0.2337,0.195,0.3153,0.3906
ISONE,2/2/2001,2001,2,2,33,4,WD,0.4274,0.3852,0.2824,0.1602,0.0986,0.0691,0.0433,0.042,0.0318,0.0266,0.0362,0.0866,0.1252,0.0866,0.0674,0.0636,0.0984,0.1026,0.0539,0.0444,0.0499,0.0708,0.1746,0.386
ISONE,2/3/2001,2001,2,3,34,4,WE,0.7928,0.907,0.9719,0.9738,0.9713,0.9679,0.969,0.962,0.9646,0.9608,0.9292,0.867,0.7651,0.7385,0.7083,0.7369,0.7052,0.6715,0.5892,0.7228,0.7311,0.6231,0.632,0.5806
ISONE,2/4/2001,2001,2,4,35,5,WE,0.4701,0.3404,0.2793,0.1973,0.1489,0.0792,0.0532,0.026,0.0154,0.0098,0.0109,0.0099,0.0115,0.0148,0.0391,0.0689,0.0691,0.0754,0.0679,0.0596,0.0479,0.0366,0.0486,0.0336
ISONE,2/5/2001,2001,2,5,36,5,WD,0.0392,0.0459,0.047,0.0643,0.1067,0.3047,0.427,0.5478,0.6917,0.8673,0.9213,0.961,0.9697,0.9727,0.9742,0.9745,0.9749,0.975,0.975,0.975,0.9405,0.9444,0.9745,0.975
ISONE,2/6/2001,2001,2,6,37,5,WD,0.975,0.9749,0.9749,0.975,0.9749,0.9749,0.9747,0.9743,0.9731,0.9716,0.9702,0.9599,0.953,0.9387,0.9412,0.9513,0.9281,0.8759,0.9122,0.8659,0.7642,0.7282,0.6277,0.4953
ISONE,2/7/2001,2001,2,7,38,5,WD,0.4963,0.308,0.3015,0.1975,0.1593,0.3133,0.5373,0.4952,0.4771,0.5634,0.6655,0.7175,0.5773,0.485,0.3595,0.3577,0.5237,0.7257,0.8122,0.8824,0.8562,0.7773,0.7875,0.8033
ISONE,2/8/2001,2001,2,8,39,5,WD,0.7566,0.7805,0.7348,0.613,0.4448,0.3654,0.3799,0.3269,0.2869,0.1941,0.1463,0.0926,0.0776,0.0428,0.0668,0.0745,0.142,0.1238,0.06,0.039,0.0285,0.0159,0.0205,0.0246
ISONE,2/9/2001,2001,2,9,40,5,WD,0.05,0.0844,0.1141,0.1777,0.2749,0.3887,0.6261,0.7474,0.8125,0.9367,0.9555,0.9638,0.9701,0.9708,0.9724,0.9728,0.975,0.975,0.975,0.975,0.975,0.975,0.975,0.9741
ISONE,2/10/2001,2001,2,10,41,5,WE,0.9732,0.9719,0.9737,0.9714,0.966,0.9636,0.9683,0.9591,0.9746,0.975,0.975,0.9748,0.975,0.9745,0.975,0.975,0.9749,0.975,0.975,0.9749,0.974,0.974,0.9745,0.975
ISONE,2/11/2001,2001,2,11,42,6,WE,0.975,0.9744,0.9745,0.9744,0.9748,0.9749,0.9749,0.9748,0.9749,0.9749,0.9741,0.9738,0.972,0.9702,0.9661,0.9699,0.9689,0.968,0.9647,0.9631,0.9571,0.9562,0.9324,0.922
ISONE,2/12/2001,2001,2,12,43,6,WD,0.8823,0.8048,0.7242,0.6288,0.561,0.4635,0.272,0.1934,0.1214,0.077,0.0524,0.0206,0.0029,0.0064,0.014,0.0439,0.0714,0.1514,0.2231,0.295,0.3505,0.3109,0.2636,0.2019
ISONE,2/13/2001,2001,2,13,44,6,WD,0.0759,0.046,0.0392,0.0169,0.0173,0.027,0.0409,0.0824,0.1733,0.2786,0.3156,0.2433,0.1933,0.1235,0.1477,0.1141,0.1051,0.1109,0.1048,0.0999,0.0688,0.0717,0.0515,0.0706
ISONE,2/14/2001,2001,2,14,45,6,WD,0.0829,0.0575,0.061,0.0653,0.0559,0.0823,0.1351,0.1633,0.2257,0.281,0.3171,0.19,0.1729,0.231,0.286,0.4438,0.622,0.7394,0.7691,0.8961,0.9518,0.9493,0.9739,0.9736
ISONE,2/15/2001,2001,2,15,46,6,WD,0.9742,0.9738,0.9715,0.9723,0.9201,0.9379,0.8687,0.8761,0.9023,0.894,0.8358,0.7524,0.6604,0.5905,0.5257,0.4383,0.3389,0.3304,0.3123,0.2087,0.292,0.244,0.2683,0.2578
ISONE,2/16/2001,2001,2,16,47,6,WD,0.2285,0.2586,0.109,0.0615,0.0292,0.0308,0.0247,0.0519,0.0951,0.1079,0.1038,0.117,0.1105,0.027,0.0098,0.0117,0.0149,0.0556,0.085,0.2589,0.5478,0.7057,0.4778,0.3525
ISONE,2/17/2001,2001,2,17,48,6,WE,0.191,0.1199,0.1011,0.1668,0.2498,0.4895,0.6417,0.7734,0.8975,0.9419,0.9679,0.9654,0.9695,0.9702,0.9744,0.9749,0.9749,0.975,0.975,0.975,0.9748,0.9744,0.9746,0.9748
ISONE,2/18/2001,2001,2,18,49,7,WE,0.9747,0.9738,0.9694,0.9596,0.9438,0.8775,0.821,0.7795,0.6285,0.5811,0.5873,0.5457,0.5054,0.367,0.2348,0.2444,0.2635,0.3525,0.3527,0.4673,0.5921,0.5447,0.542,0.4567
ISONE,2/19/2001,2001,2,19,50,7,WD,0.4055,0.3799,0.2437,0.1796,0.157,0.1554,0.1389,0.1659,0.2387,0.3797,0.4124,0.555,0.6212,0.7208,0.797,0.831,0.8929,0.9015,0.8937,0.9041,0.8692,0.9237,0.9263,0.9258
ISONE,2/20/2001,2001,2,20,51,7,WD,0.9555,0.9612,0.9652,0.9728,0.9727,0.9698,0.9606,0.9608,0.9172,0.8232,0.6432,0.6388,0.6494,0.636,0.5215,0.524,0.6467,0.7571,0.8317,0.8919,0.8783,0.9012,0.9526,0.9701
ISONE,2/21/2001,2001,2,21,52,7,WD,0.9646,0.9664,0.9695,0.9622,0.948,0.8905,0.7287,0.6192,0.6485,0.6337,0.6899,0.703,0.7787,0.7839,0.8595,0.9346,0.9467,0.9695,0.9741,0.9743,0.9745,0.9741,0.973,0.9709
ISONE,2/22/2001,2001,2,22,53,7,WD,0.9531,0.9267,0.8098,0.7318,0.5964,0.419,0.3263,0.3067,0.3299,0.3336,0.255,0.1974,0.138,0.0861,0.0835,0.0842,0.0689,0.0579,0.1143,0.1938,0.2634,0.3516,0.3878,0.3513
ISONE,2/23/2001,2001,2,23,54,7,WD,0.2644,0.4335,0.5412,0.6364,0.4885,0.4343,0.3171,0.3001,0.2325,0.2411,0.176,0.1522,0.2147,0.4061,0.7062,0.8083,0.8818,0.9163,0.9531,0.9676,0.9698,0.9725,0.9746,0.9748
ISONE,2/24/2001,2001,2,24,55,7,WE,0.9745,0.9743,0.9742,0.9662,0.8793,0.902,0.89,0.8437,0.8257,0.7449,0.6306,0.5166,0.3817,0.3475,0.2561,0.1838,0.1569,0.1226,0.1228,0.1286,0.113,0.1094,0.0983,0.0917
ISONE,2/25/2001,2001,2,25,56,8,WE,0.0779,0.0761,0.071,0.086,0.1003,0.1142,0.1211,0.1848,0.3207,0.5836,0.8001,0.8884,0.9456,0.9701,0.9745,0.9745,0.9748,0.975,0.975,0.975,0.9692,0.9692,0.9746,0.9749
ISONE,2/26/2001,2001,2,26,57,8,WD,0.9749,0.975,0.9736,0.9674,0.9624,0.8914,0.9158,0.9178,0.9312,0.9256,0.9461,0.9397,0.9519,0.9545,0.9575,0.963,0.9479,0.9656,0.9661,0.9617,0.958,0.964,0.9656,0.9587
ISONE,2/27/2001,2001,2,27,58,8,WD,0.954,0.9505,0.9198,0.8867,0.8923,0.8125,0.7388,0.6471,0.5338,0.3369,0.3011,0.2391,0.2123,0.2252,0.2575,0.3576,0.546,0.6254,0.6516,0.6943,0.7234,0.7934,0.7986,0.8317
ISONE,2/28/2001,2001,2,28,59,8,WD,0.7869,0.6972,0.5623,0.4636,0.4663,0.5441,0.6288,0.6346,0.6703,0.6481,0.5453,0.4727,0.4014,0.4193,0.4187,0.4136,0.4251,0.4862,0.4578,0.5304,0.6281,0.6697,0.828,0.8145
ISONE,3/1/2001,2001,3,1,60,8,WD,0.8563,0.8063,0.6718,0.4999,0.3767,0.2678,0.2408,0.2073,0.1987,0.2124,0.2757,0.2477,0.2711,0.2745,0.3696,0.4193,0.5022,0.5701,0.7239,0.7058,0.6721,0.612,0.5629,0.5131
ISONE,3/2/2001,2001,3,2,61,8,WD,0.4415,0.3044,0.2297,0.1355,0.126,0.0811,0.1039,0.1574,0.1647,0.163,0.1631,0.1125,0.1278,0.0921,0.0671,0.0565,0.0447,0.0819,0.0861,0.1773,0.2884,0.3799,0.4671,0.4179
ISONE,3/3/2001,2001,3,3,62,8,WE,0.3111,0.2768,0.2183,0.2009,0.2109,0.202,0.1767,0.1666,0.181,0.1628,0.1709,0.123,0.1094,0.0842,0.0576,0.0542,0.068,0.1229,0.2243,0.3176,0.293,0.2933,0.281,0.324
ISONE,3/4/2001,2001,3,4,63,9,WE,0.2953,0.3544,0.3814,0.3654,0.4418,0.4783,0.4333,0.4409,0.4729,0.6197,0.6174,0.6227,0.5659,0.6048,0.6047,0.6203,0.6685,0.7269,0.6981,0.6946,0.8283,0.8699,0.8654,0.9355
ISONE,3/5/2001,2001,3,5,64,9,WD,0.9548,0.9737,0.9749,0.975,0.975,0.975,0.975,0.975,0.975,0.975,0.975,0.975,0.975,0.975,0.975,0.975,0.975,0.975,0.975,0.975,0.975,0.975,0.975,0.975
ISONE,3/6/2001,2001,3,6,65,9,WD,0.975,0.975,0.975,0.975,0.9749,0.9746,0.9743,0.9749,0.9749,0.975,0.975,0.975,0.975,0.975,0.975,0.9747,0.9744,0.9745,0.9749,0.975,0.9745,0.9749,0.9748,0.9749
ISONE,3/7/2001,2001,3,7,66,9,WD,0.975,0.975,0.975,0.9749,0.9747,0.9746,0.9742,0.9743,0.9739,0.9727,0.9711,0.9681,0.9647,0.9548,0.9557,0.9477,0.9256,0.8738,0.8254,0.7456,0.6354,0.6016,0.5561,0.5914
ISONE,3/8/2001,2001,3,8,67,9,WD,0.5064,0.4813,0.5003,0.4513,0.4373,0.3933,0.3844,0.3194,0.2099,0.1911,0.144,0.0991,0.0514,0.0233,0.0134,0.0097,0.006,0.0162,0.0403,0.0377,0.0422,0.0683,0.1019,0.1156
ISONE,3/9/2001,2001,3,9,68,9,WD,0.0644,0.088,0.132,0.152,0.1441,0.2545,0.356,0.408,0.5387,0.6984,0.8128,0.9256,0.9514,0.9709,0.9743,0.9724,0.8583,0.401,0.1792,0.1261,0.2298,0.3181,0.4143,0.5604
ISONE,3/10/2001,2001,3,10,69,9,WE,0.7442,0.7661,0.9205,0.9735,0.9738,0.9738,0.9736,0.9714,0.9707,0.9716,0.9728,0.9721,0.9702,0.9671,0.9498,0.9194,0.8658,0.8328,0.8486,0.7977,0.7934,0.7814,0.7391,0.6494
ISONE,3/11/2001,2001,3,11,70,10,WE,0.5531,0.4179,0.3781,0.4037,0.3833,0.4056,0.4191,0.3723,0.4324,0.6167,0.7621,0.8181,0.9007,0.9401,0.9709,0.9725,0.974,0.9736,0.9735,0.9736,0.97,0.9649,0.9654,0.9665
ISONE,3/12/2001,2001,3,12,71,10,WD,0.9678,0.9665,0.9464,0.903,0.8094,0.769,0.6313,0.5435,0.4244,0.2641,0.1688,0.1145,0.0278,0.0036,0.0038,0.0032,0.0115,0.0101,0.0232,0.0596,0.1149,0.1478,0.1855,0.2709
ISONE,3/13/2001,2001,3,13,72,10,WD,0.392,0.5134,0.8153,0.927,0.9676,0.9749,0.975,0.975,0.9714,0.9717,0.9749,0.9701,0.975,0.9744,0.9742,0.9724,0.9683,0.9298,0.9239,0.8304,0.8607,0.945,0.9595,0.9388
ISONE,3/14/2001,2001,3,14,73,10,WD,0.9309,0.8767,0.7881,0.7198,0.7604,0.7026,0.5753,0.4368,0.522,0.6599,0.691,0.8247,0.8529,0.8988,0.9603,0.9703,0.9725,0.9738,0.9743,0.9746,0.9747,0.9737,0.9746,0.9745
ISONE,3/15/2001,2001,3,15,74,10,WD,0.9695,0.9696,0.9584,0.9401,0.9172,0.8756,0.8122,0.6232,0.5247,0.4756,0.6478,0.7861,0.8946,0.9208,0.9354,0.9266,0.9176,0.9173,0.8604,0.6152,0.508,0.3887,0.3566,0.3455
ISONE,3/16/2001,2001,3,16,75,10,WD,0.2577,0.1721,0.0877,0.1106,0.241,0.5452,0.6574,0.6846,0.6241,0.4711,0.2358,0.1596,0.0842,0.0173,0.0055,0.0023,0.0173,0.024,0.0401,0.0255,0.0435,0.0503,0.0708,0.0808
ISONE,3/17/2001,2001,3,17,76,10,WE,0.0624,0.0407,0.0719,0.1068,0.176,0.2379,0.325,0.3718,0.408,0.3564,0.2808,0.2437,0.2053,0.1469,0.1401,0.1244,0.073,0.0685,0.0748,0.0686,0.05,0.0616,0.0483,0.0807
ISONE,3/18/2001,2001,3,18,77,11,WE,0.1067,0.1272,0.209,0.2445,0.2946,0.3972,0.3789,0.457,0.4328,0.5358,0.53,0.4737,0.4925,0.4419,0.5884,0.5804,0.5862,0.6285,0.4942,0.4554,0.5273,0.7312,0.9603,0.9689
ISONE,3/19/2001,2001,3,19,78,11,WD,0.9644,0.962,0.9343,0.9192,0.8605,0.8086,0.8411,0.8438,0.7757,0.6227,0.4314,0.3154,0.1609,0.0751,0.0175,0.0268,0.0442,0.0381,0.0374,0.0456,0.0477,0.0436,0.0682,0.158
ISONE,3/20/2001,2001,3,20,79,11,WD,0.3642,0.5344,0.5658,0.4549,0.3377,0.2263,0.1749,0.1463,0.1548,0.1889,0.1696,0.2146,0.1799,0.1679,0.1885,0.15,0.1122,0.0886,0.1163,0.1191,0.1197,0.1086,0.1384,0.1694
ISONE,3/21/2001,2001,3,21,80,11,WD,0.1865,0.2341,0.2846,0.3738,0.4056,0.535,0.6487,0.6184,0.8658,0.9392,0.9503,0.9713,0.9717,0.9739,0.9737,0.9745,0.9746,0.9749,0.975,0.975,0.975,0.975,0.975,0.975
ISONE,3/22/2001,2001,3,22,81,11,WD,0.975,0.9741,0.9649,0.9688,0.9732,0.975,0.975,0.975,0.9747,0.9737,0.9654,0.9456,0.8843,0.6322,0.5043,0.2404,0.155,0.2613,0.2953,0.3171,0.3466,0.5263,0.5861,0.7621
ISONE,3/23/2001,2001,3,23,82,11,WD,0.9122,0.9621,0.9673,0.975,0.975,0.975,0.9749,0.9749,0.9749,0.975,0.9748,0.9738,0.9745,0.9749,0.9745,0.9733,0.9704,0.9701,0.9712,0.971,0.9729,0.9733,0.9742,0.9748
ISONE,3/24/2001,2001,3,24,83,11,WE,0.9746,0.9743,0.9744,0.9727,0.9634,0.9542,0.9282,0.8965,0.8797,0.7361,0.7039,0.6792,0.8507,0.9175,0.9622,0.9684,0.9699,0.964,0.9665,0.9696,0.9692,0.919,0.8932,0.8579
ISONE,3/25/2001,2001,3,25,84,12,WE,0.8801,0.9418,0.9592,0.9493,0.9175,0.8808,0.7739,0.7097,0.5763,0.5352,0.3931,0.3282,0.2753,0.2569,0.2933,0.3526,0.4622,0.4218,0.4435,0.4601,0.487,0.4958,0.5453,0.6027
ISONE,3/26/2001,2001,3,26,85,12,WD,0.6472,0.6082,0.5721,0.5633,0.542,0.3888,0.3577,0.349,0.2823,0.2412,0.1371,0.0856,0.0607,0.0316,0.0098,0.0057,0.0152,0.0148,0.0206,0.0339,0.0757,0.1899,0.3872,0.6209
ISONE,3/27/2001,2001,3,27,86,12,WD,0.8204,0.912,0.9437,0.9252,0.8969,0.9218,0.8138,0.723,0.6175,0.5122,0.3365,0.2315,0.2213,0.2004,0.2379,0.266,0.3809,0.5744,0.8454,0.9405,0.9657,0.9645,0.946,0.9179
ISONE,3/28/2001,2001,3,28,87,12,WD,0.9111,0.8277,0.7149,0.6441,0.5839,0.6261,0.5364,0.469,0.4075,0.3532,0.3455,0.3529,0.4742,0.5939,0.6143,0.7145,0.7812,0.6509,0.6884,0.7104,0.6939,0.5818,0.5012,0.3179
ISONE,3/29/2001,2001,3,29,88,12,WD,0.2928,0.1565,0.1651,0.304,0.2522,0.3665,0.3647,0.2645,0.148,0.176,0.1834,0.1213,0.1488,0.1273,0.1357,0.1752,0.2617,0.298,0.3051,0.2715,0.2752,0.3313,0.3591,0.5163
ISONE,3/30/2001,2001,3,30,89,12,WD,0.5382,0.7301,0.8092,0.9173,0.9714,0.974,0.975,0.975,0.975,0.975,0.975,0.975,0.975,0.9739,0.9353,0.8036,0.7352,0.802,0.8151,0.741,0.7925,0.6107,0.506,0.599
ISONE,3/31/2001,2001,3,31,90,12,WE,0.6724,0.8092,0.7881,0.7858,0.8003,0.7289,0.6311,0.5463,0.4876,0.4268,0.3816,0.3509,0.2404,0.191,0.1816,0.1618,0.0944,0.1635,0.2213,0.2309,0.2438,0.212,0.1773,0.2116
ISONE,4/1/2001,2001,4,1,91,13,WE,0.2001,0.1746,0.149,0.1673,0.1991,0.2897,0.4272,0.4744,0.5311,0.4848,0.5454,0.5378,0.5082,0.5287,0.4743,0.4387,0.472,0.4446,0.5045,0.6634,0.8119,0.7599,0.6326,0.6671
ISONE,4/2/2001,2001,4,2,92,13,WD,0.7159,0.7415,0.7903,0.7587,0.7563,0.7822,0.8029,0.8288,0.8695,0.8618,0.8039,0.732,0.5807,0.4647,0.2563,0.2359,0.1953,0.1457,0.1184,0.1092,0.1373,0.1791,0.2379,0.2513
ISONE,4/3/2001,2001,4,3,93,13,WD,0.2611,0.3797,0.3786,0.3037,0.2884,0.4111,0.4369,0.4943,0.3764,0.3328,0.2476,0.1588,0.0889,0.0476,0.0364,0.0461,0.0491,0.0541,0.0284,0.0564,0.0681,0.0705,0.0527,0.0349
ISONE,4/4/2001,2001,4,4,94,13,WD,0.0337,0.0146,0.0112,0.019,0.041,0.0385,0.0336,0.0393,0.039,0.0382,0.0283,0.0334,0.0715,0.065,0.051,0.0436,0.0259,0.045,0.0477,0.0365,0.0217,0.0157,0.0222,0.0389
ISONE,4/5/2001,2001,4,5,95,13,WD,0.045,0.0434,0.0271,0.0784,0.1081,0.128,0.1501,0.1773,0.1686,0.1149,0.0809,0.0432,0.0246,0.0083,0.0075,0.0334,0.0618,0.1012,0.111,0.1212,0.1432,0.1984,0.2896,0.3828
ISONE,4/6/2001,2001,4,6,96,13,WD,0.4221,0.4957,0.5263,0.5188,0.5141,0.7239,0.8383,0.8914,0.9237,0.8765,0.8201,0.7782,0.8787,0.9492,0.9585,0.9631,0.9674,0.9694,0.9706,0.9714,0.9631,0.9339,0.7939,0.5579
ISONE,4/7/2001,2001,4,7,97,13,WE,0.4494,0.4891,0.663,0.8653,0.9155,0.9702,0.9724,0.9715,0.9579,0.9327,0.857,0.836,0.783,0.6145,0.5502,0.4603,0.5325,0.4778,0.4019,0.3873,0.3427,0.2992,0.3562,0.3615
ISONE,4/8/2001,2001,4,8,98,14,WE,0.321,0.3503,0.3722,0.3287,0.3361,0.4191,0.422,0.5562,0.5737,0.7323,0.8166,0.8562,0.9433,0.9531,0.9714,0.9734,0.9743,0.9718,0.9705,0.9689,0.9639,0.9413,0.8487,0.7241
ISONE,4/9/2001,2001,4,9,99,14,WD,0.6983,0.5388,0.7605,0.7852,0.8395,0.8932,0.9242,0.9299,0.9001,0.8995,0.9003,0.8052,0.6428,0.3416,0.2427,0.2185,0.3212,0.2943,0.3926,0.3634,0.2541,0.1359,0.1313,0.1513
ISONE,4/10/2001,2001,4,10,100,14,WD,0.3065,0.5356,0.6803,0.7057,0.6227,0.5802,0.4634,0.5808,0.6225,0.6634,0.6065,0.6049,0.4529,0.4436,0.4182,0.3785,0.4614,0.4615,0.3601,0.2084,0.1028,0.1144,0.061,0.0685
ISONE,4/11/2001,2001,4,11,101,14,WD,0.1216,0.0521,0.0406,0.0524,0.0552,0.0333,0.0478,0.0504,0.0882,0.0904,0.1472,0.1449,0.1476,0.1442,0.1662,0.1991,0.2185,0.2609,0.3045,0.3963,0.3464,0.4275,0.5199,0.5489
ISONE,4/12/2001,2001,4,12,102,14,WD,0.5908,0.6206,0.6778,0.7693,0.8386,0.9459,0.9645,0.9703,0.9724,0.9747,0.9745,0.9748,0.975,0.975,0.9748,0.9748,0.9745,0.975,0.9723,0.9736,0.9739,0.974,0.974,0.9704
ISONE,4/13/2001,2001,4,13,103,14,WD,0.9725,0.9724,0.9723,0.9734,0.9709,0.9677,0.9519,0.925,0.9206,0.9246,0.8574,0.913,0.8586,0.8872,0.9306,0.954,0.9579,0.9598,0.9564,0.933,0.9141,0.937,0.9323,0.896
ISONE,4/14/2001,2001,4,14,104,14,WE,0.9216,0.8211,0.7559,0.8139,0.8196,0.8239,0.9223,0.9077,0.8548,0.8319,0.7197,0.5204,0.4259,0.4748,0.4864,0.7733,0.8225,0.8201,0.7759,0.774,0.7843,0.7949,0.7243,0.5779
ISONE,4/15/2001,2001,4,15,105,15,WE,0.6015,0.5856,0.3963,0.199,0.2147,0.1699,0.1262,0.1446,0.1473,0.1823,0.2068,0.1933,0.225,0.214,0.1938,0.2254,0.2135,0.1772,0.1344,0.1405,0.1569,0.1552,0.1317,0.1456
ISONE,4/16/2001,2001,4,16,106,15,WD,0.1264,0.1334,0.0993,0.1184,0.1558,0.1574,0.2613,0.335,0.316,0.4241,0.4163,0.3095,0.2665,0.26,0.1941,0.1455,0.1318,0.1673,0.1035,0.0932,0.0975,0.1547,0.2516,0.4191
ISONE,4/17/2001,2001,4,17,107,15,WD,0.5861,0.572,0.4685,0.4128,0.3141,0.1899,0.1415,0.1372,0.1394,0.1154,0.0662,0.074,0.072,0.1221,0.1258,0.1322,0.1401,0.101,0.0998,0.0721,0.099,0.1458,0.2015,0.3102
ISONE,4/18/2001,2001,4,18,108,15,WD,0.5378,0.9298,0.9661,0.9701,0.9716,0.9705,0.9718,0.974,0.9728,0.9706,0.9706,0.9671,0.9558,0.9263,0.9102,0.7889,0.6579,0.4201,0.251,0.2021,0.2347,0.2872,0.3279,0.2644
ISONE,4/19/2001,2001,4,19,109,15,WD,0.1599,0.162,0.1261,0.1145,0.172,0.1196,0.1371,0.1513,0.1625,0.1239,0.0979,0.0668,0.0445,0.0841,0.1844,0.378,0.5166,0.5544,0.6078,0.6746,0.6877,0.7692,0.7717,0.6855
ISONE,4/20/2001,2001,4,20,110,15,WD,0.6093,0.604,0.4932,0.4568,0.3542,0.2688,0.1506,0.1192,0.1253,0.1442,0.1035,0.1383,0.2679,0.486,0.6858,0.8605,0.9228,0.9618,0.9665,0.968,0.9724,0.9733,0.9726,0.9647
ISONE,4/21/2001,2001,4,21,111,15,WE,0.9614,0.9627,0.955,0.9078,0.8311,0.7422,0.6707,0.7921,0.9006,0.9682,0.9699,0.9698,0.9639,0.9678,0.9537,0.9393,0.8769,0.8434,0.775,0.7595,0.6822,0.6798,0.7075,0.8769
ISONE,4/22/2001,2001,4,22,112,16,WE,0.9647,0.9607,0.9696,0.9729,0.9716,0.9712,0.9745,0.9747,0.9748,0.975,0.9743,0.9742,0.9734,0.9748,0.975,0.9749,0.9747,0.9746,0.9744,0.9736,0.9606,0.8532,0.8072,0.5822
ISONE,4/23/2001,2001,4,23,113,16,WD,0.4809,0.3652,0.2935,0.1889,0.1344,0.1265,0.0805,0.0648,0.0547,0.0359,0.0217,0.0092,0.0224,0.0381,0.0678,0.0981,0.0996,0.1696,0.3127,0.3734,0.5582,0.6049,0.6645,0.7041
ISONE,4/24/2001,2001,4,24,114,16,WD,0.7253,0.8792,0.9251,0.8906,0.9111,0.9554,0.9689,0.9747,0.9749,0.975,0.975,0.9746,0.9745,0.975,0.975,0.975,0.975,0.975,0.975,0.9748,0.9744,0.9727,0.955,0.9399
ISONE,4/25/2001,2001,4,25,115,16,WD,0.9183,0.955,0.9403,0.9019,0.7151,0.6889,0.5625,0.4046,0.4711,0.4998,0.6371,0.643,0.5193,0.4674,0.488,0.488,0.3248,0.2297,0.1699,0.2102,0.1776,0.1558,0.1109,0.0696
ISONE,4/26/2001,2001,4,26,116,16,WD,0.0475,0.0225,0.0204,0.0329,0.0481,0.0716,0.0769,0.0881,0.1338,0.2118,0.263,0.2782,0.2942,0.3812,0.4724,0.68,0.8004,0.7545,0.8026,0.7492,0.7387,0.6998,0.7597,0.8201
ISONE,4/27/2001,2001,4,27,117,16,WD,0.7906,0.7276,0.8363,0.8316,0.8344,0.9024,0.8723,0.8532,0.8044,0.8195,0.7395,0.7163,0.5442,0.4468,0.3753,0.3405,0.1433,0.1036,0.1256,0.1589,0.2621,0.355,0.4089,0.7367
ISONE,4/28/2001,2001,4,28,118,16,WE,0.846,0.7372,0.6411,0.5909,0.5957,0.8149,0.8893,0.9079,0.8494,0.7656,0.6086,0.5986,0.4805,0.3638,0.3527,0.3537,0.237,0.2617,0.1862,0.1568,0.0973,0.0414,0.0371,0.0988
ISONE,4/29/2001,2001,4,29,119,17,WE,0.2145,0.4807,0.6514,0.5667,0.3742,0.3336,0.1996,0.1775,0.1555,0.1282,0.1031,0.0406,0.0149,0.0126,0.0493,0.107,0.1596,0.2641,0.3089,0.2866,0.2723,0.2281,0.2666,0.3383
ISONE,4/30/2001,2001,4,30,120,17,WD,0.3577,0.4884,0.525,0.5057,0.5063,0.4986,0.462,0.5139,0.4789,0.4908,0.4832,0.4265,0.4125,0.493,0.6375,0.7691,0.8475,0.9292,0.9555,0.959,0.9697,0.9579,0.9593,0.9303
ISONE,5/1/2001,2001,5,1,121,17,WD,0.9035,0.9139,0.8363,0.7683,0.5846,0.5231,0.4411,0.3301,0.2878,0.1452,0.0716,0.0419,0.029,0.0099,0.018,0.0573,0.1805,0.2868,0.4363,0.6995,0.856,0.8762,0.9293,0.9682
ISONE,5/2/2001,2001,5,2,122,17,WD,0.9702,0.9715,0.968,0.957,0.968,0.9636,0.9517,0.9532,0.839,0.738,0.5317,0.4971,0.574,0.7047,0.786,0.8738,0.9199,0.9579,0.9739,0.9738,0.9746,0.9747,0.975,0.9662
ISONE,5/3/2001,2001,5,3,123,17,WD,0.9685,0.9611,0.9127,0.8106,0.6616,0.3906,0.3222,0.1994,0.1456,0.1441,0.0932,0.0541,0.0419,0.0549,0.1359,0.3974,0.5779,0.6826,0.752,0.7971,0.8549,0.8256,0.8724,0.9281
ISONE,5/4/2001,2001,5,4,124,17,WD,0.9183,0.9328,0.8676,0.8404,0.8099,0.6452,0.4311,0.3824,0.3248,0.2762,0.2317,0.2085,0.1782,0.2251,0.3025,0.416,0.5694,0.7286,0.857,0.8342,0.9323,0.9601,0.9719,0.9722
ISONE,5/5/2001,2001,5,5,125,17,WE,0.9692,0.9572,0.939,0.8864,0.6488,0.4779,0.3654,0.4566,0.6328,0.6895,0.7029,0.631,0.6242,0.6531,0.6,0.426,0.3943,0.4064,0.3733,0.3594,0.4104,0.4176,0.4258,0.326
ISONE,5/6/2001,2001,5,6,126,18,WE,0.1846,0.1152,0.1387,0.2454,0.4175,0.5306,0.5868,0.6806,0.7761,0.8445,0.7922,0.7798,0.7626,0.8023,0.8616,0.8613,0.8294,0.8667,0.84,0.8061,0.6584,0.4682,0.4293,0.3287
ISONE,5/7/2001,2001,5,7,127,18,WD,0.2957,0.2175,0.1752,0.1226,0.1216,0.1259,0.1116,0.1662,0.2551,0.238,0.1849,0.1996,0.2321,0.1858,0.104,0.0668,0.0759,0.0561,0.0389,0.0555,0.0462,0.0699,0.0843,0.0944
ISONE,5/8/2001,2001,5,8,128,18,WD,0.0797,0.0644,0.0566,0.0585,0.0462,0.0497,0.0499,0.0411,0.0284,0.0195,0.0113,0.0048,0.0117,0.0095,0.0181,0.0445,0.0736,0.0975,0.1306,0.195,0.1897,0.2218,0.1904,0.1332
ISONE,5/9/2001,2001,5,9,129,18,WD,0.0952,0.0593,0.0347,0.0266,0.0154,0.0104,0.0285,0.0259,0.0272,0.0288,0.039,0.0281,0.0463,0.0614,0.0796,0.1189,0.0866,0.0917,0.0839,0.0606,0.0749,0.0551,0.0455,0.0295
ISONE,5/10/2001,2001,5,10,130,18,WD,0.0193,0.0127,0.0183,0.0293,0.0324,0.0567,0.0313,0.027,0.022,0.0187,0.0164,0.0124,0.0038,0.0053,0.029,0.0585,0.133,0.1398,0.2108,0.3189,0.3953,0.5905,0.7323,0.8084
